pax,El Salvador,47.0,SLV,92.0,SV,222.0,SAL,2.0,All,https://pax.peaceagreements.org/tracker/all,https://pax.peaceagreements.org/agreements/search/results?region=&countries=47&name=&match_any_issues=True&text=&search_type=simple,15,2,"<ul><li>The most recent agreement signed in El Salvador was <a href=""https://pax.peaceagreements.org/agreements/424/"" target=""_blank"">Joint Declaration Signed on 4 October 1994 by the Representatives of the Govt of El Salvador and of the Frente Farabundo Marti para la Liberacion Nacional (FMLN) (04/10/1994)</a>, as part of the El Salvador peace process.</li><li>There has been a total of 15 agreements in El Salvador, since the first agreement was signed in 1990 (<a href=""https://pax.peaceagreements.org/agreements/887/"" target=""_blank"">Montelimar Declaration (03/04/1990)</a>), in 2 peace processes (El Salvador peace process, Nicaragua contra process).</li></ul>",,,,,,,,,,,,,,,,,,,,222,El Salvador,20.0,137,0.0,15.0,0.0,17.0,27.0,93,-2.0,0.0,44,-7.0,-11.76470588235294,0.0,47.31182795698925,-25.925925925925924,2025-01-17,114.0,163,El Salvador ranked 114 out of 163 countries in the Global Peace Index (2022).,126.0,181,El Salvador ranked 126 out of 181 countries in the Corruption Perception Index (2023).,"In the current period of analysis (Aug 2021) by the <a href='https://data.humdata.org/dataset/global-acute-food-insecurity-country-data', target='_blank'>IPC</a>, 13% of the population of El Salvador are in IPC Phase 3+ (in food crisis), an estimated 841190 people. 1% (60879 people) are estimated to be in Phase 4 (emergency).","In El Salvador there has been a total of 48,633 people displaced, with 66,000 new displacements in 2023 [<a href='https://data.humdata.org/dataset/idmc-internal-displacements-new-displacements-idps', target='_blank'>IDMC</a>].","There is 1 current crisis and severity category listed in the <a href=""https://www.acaps.org/en/thematics/all-topics/inform-severity-index"" target=""_blank"">INFORM Severity Index</a> for El Salvador: Complex crisis in El Salvador (High), as of 14/11/24.",,"<ul><li>In the current period of analysis (Aug 2021) by the <a href='https://data.humdata.org/dataset/global-acute-food-insecurity-country-data', target='_blank'>IPC</a>, 13% of the population of El Salvador are in IPC Phase 3+ (in food crisis), an estimated 841190 people. 1% (60879 people) are estimated to be in Phase 4 (emergency).</li><li>In El Salvador there has been a total of 48,633 people displaced, with 66,000 new displacements in 2023 [<a href='https://data.humdata.org/dataset/idmc-internal-displacements-new-displacements-idps', target='_blank'>IDMC</a>].</li><li>There is 1 current crisis and severity category listed in the <a href=""https://www.acaps.org/en/thematics/all-topics/inform-severity-index"" target=""_blank"">INFORM Severity Index</a> for El Salvador: Complex crisis in El Salvador (High), as of 14/11/24.</li></ul>","<ul><li>El Salvador ranked 114 out of 163 countries in the Global Peace Index (2022).</li><li>El Salvador ranked 126 out of 181 countries in the Corruption Perception Index (2023).</li><li>In the current period of analysis (Aug 2021) by the <a href='https://data.humdata.org/dataset/global-acute-food-insecurity-country-data', target='_blank'>IPC</a>, 13% of the population of El Salvador are in IPC Phase 3+ (in food crisis), an estimated 841190 people. 1% (60879 people) are estimated to be in Phase 4 (emergency).</li><li>In El Salvador there has been a total of 48,633 people displaced, with 66,000 new displacements in 2023 [<a href='https://data.humdata.org/dataset/idmc-internal-displacements-new-displacements-idps', target='_blank'>IDMC</a>].</li><li>There is 1 current crisis and severity category listed in the <a href=""https://www.acaps.org/en/thematics/all-topics/inform-severity-index"" target=""_blank"">INFORM Severity Index</a> for El Salvador: Complex crisis in El Salvador (High), as of 14/11/24.</li></ul>"
pax,Eritrea,48.0,ERI,531.0,ER,232.0,ERI,2.0,All,https://pax.peaceagreements.org/tracker/all,https://pax.peaceagreements.org/agreements/search/results?region=&countries=48&name=&match_any_issues=True&text=&search_type=simple,12,3,"<ul><li>The most recent agreement signed in Eritrea was <a href=""https://pax.peaceagreements.org/agreements/2098/"" target=""_blank"">Agreement on Peace, Friendship and Comprehensive Cooperation Between the Federal Democratic Republic of Ethiopia and the State of Eritrea (16/09/2018)</a>, as part of the Eritrea-Ethiopia border dispute peace process.</li><li>There has been a total of 12 agreements in Eritrea, since the first agreement was signed in 1998 (<a href=""https://pax.peaceagreements.org/agreements/599/"" target=""_blank"">UN Security Council Resolution 1177 (26/06/1998)</a>), in 3 peace processes (Eritrea-Ethiopia border dispute peace process, Eritrea-Sudan peace process, Djibouti-Eritrea border dispute peace process).</li></ul>",,,,,,,,,,,,,,,,,,,,232,Eritrea,0.0,12,0.0,0.0,0.0,0.0,1.0,6,0.0,0.0,6,-1.0,0.0,0.0,100.0,-100.0,2025-01-17,132.0,163,Eritrea ranked 132 out of 163 countries in the Global Peace Index (2022).,161.0,181,Eritrea ranked 161 out of 181 countries in the Corruption Perception Index (2023).,,,"There is 1 current crisis and severity category listed in the <a href=""https://www.acaps.org/en/thematics/all-topics/inform-severity-index"" target=""_blank"">INFORM Severity Index</a> for Eritrea: Complex crisis in Eritrea (Medium), as of 19/12/24.",,"<ul><li>There is 1 current crisis and severity category listed in the <a href=""https://www.acaps.org/en/thematics/all-topics/inform-severity-index"" target=""_blank"">INFORM Severity Index</a> for Eritrea: Complex crisis in Eritrea (Medium), as of 19/12/24.</li></ul>","<ul><li>Eritrea ranked 132 out of 163 countries in the Global Peace Index (2022).</li><li>Eritrea ranked 161 out of 181 countries in the Corruption Perception Index (2023).</li><li>There is 1 current crisis and severity category listed in the <a href=""https://www.acaps.org/en/thematics/all-topics/inform-severity-index"" target=""_blank"">INFORM Severity Index</a> for Eritrea: Complex crisis in Eritrea (Medium), as of 19/12/24.</li></ul>"
pax,Ethiopia,49.0,ETH,530.0,ET,231.0,ETH,1.0,Ethiopia,https://pax.peaceagreements.org/tracker/ethiopia,https://pax.peaceagreements.org/agreements/search/results?region=&countries=49&name=&match_any_issues=True&text=&search_type=simple,26,7,"<ul><li>The most recent agreement signed in Ethiopia was <a href=""https://pax.peaceagreements.org/agreements/2464/"" target=""_blank"">Declaration of the Senior Commanders on the Modalities for the Implementation of the Agreement for a Lasting Peace Through a Permanent Cessation of Hostilities (12/11/2022)</a>, as part of the Ethiopia: Tigray process.</li><li>There has been a total of 26 agreements in Ethiopia, since the first agreement was signed in 1991 (<a href=""https://pax.peaceagreements.org/agreements/1300/"" target=""_blank"">Transitional Period Charter of Ethiopia (22/07/1991)</a>), in 7 peace processes (Ethiopia peace process, Somali Local Peace Processes, Kenya Local Agreements, Kenya-Ethiopia local cross-border talks, Ogaden peace process, Ethiopia: Tigray process, Eritrea-Ethiopia border dispute peace process).</li></ul>",530.0,Ethiopia,2726.0,609.0,187.0,99.0,0.0,2.0,1957.0,510.0,97.0,187.0,99.0,769.0,4850.0,0.0,19.411764705882355,39.29483903934594,2024-11-30,231,Ethiopia,10023.0,2860,306.0,144.0,852.0,282.0,3657.0,1459,-138.0,-546.0,1401,6366.0,-48.93617021276596,-64.08450704225352,96.02467443454421,174.07711238720262,2025-01-17,149.0,163,Ethiopia ranked 149 out of 163 countries in the Global Peace Index (2022).,98.0,181,Ethiopia ranked 98 out of 181 countries in the Corruption Perception Index (2023).,"In the current period of analysis (May 2021) by the <a href='https://data.humdata.org/dataset/global-acute-food-insecurity-country-data', target='_blank'>IPC</a>, 30% of the population of Ethiopia are in IPC Phase 3+ (in food crisis), an estimated 16756345 people. 8% (4331214 people) are estimated to be in Phase 4 (emergency). 352896 (1.0%) are in Phase 5 (catastrophe/famine).","In Ethiopia there has been a total of 2,852,493 people displaced, with 794,266 new displacements in 2023 [<a href='https://data.humdata.org/dataset/idmc-internal-displacements-new-displacements-idps', target='_blank'>IDMC</a>].","There are 4 current crises and severity categories listed in the <a href=""https://www.acaps.org/en/thematics/all-topics/inform-severity-index"" target=""_blank"">INFORM Severity Index</a> for Ethiopia: Complex crisis in Ethiopia (Very High), Drought in Ethiopia (Very High), International Displacement (Medium), Northern Ethiopia Conflict (Very High), as of 26/12/24.","Ethiopia is one of 12 focus countries in the UK's WPS <a href='https://assets.publishing.service.gov.uk/government/uploads/system/uploads/attachment_data/file/1156085/uk-women-peace-security-national-action-plan-2023-2027.pdf', target='_blank'>National Action Plan</a> for 2023-2027. ","<ul><li>In the current period of analysis (May 2021) by the <a href='https://data.humdata.org/dataset/global-acute-food-insecurity-country-data', target='_blank'>IPC</a>, 30% of the population of Ethiopia are in IPC Phase 3+ (in food crisis), an estimated 16756345 people. 8% (4331214 people) are estimated to be in Phase 4 (emergency). 352896 (1.0%) are in Phase 5 (catastrophe/famine).</li><li>In Ethiopia there has been a total of 2,852,493 people displaced, with 794,266 new displacements in 2023 [<a href='https://data.humdata.org/dataset/idmc-internal-displacements-new-displacements-idps', target='_blank'>IDMC</a>].</li><li>There are 4 current crises and severity categories listed in the <a href=""https://www.acaps.org/en/thematics/all-topics/inform-severity-index"" target=""_blank"">INFORM Severity Index</a> for Ethiopia: Complex crisis in Ethiopia (Very High), Drought in Ethiopia (Very High), International Displacement (Medium), Northern Ethiopia Conflict (Very High), as of 26/12/24.</li><li>Ethiopia is one of 12 focus countries in the UK's WPS <a href='https://assets.publishing.service.gov.uk/government/uploads/system/uploads/attachment_data/file/1156085/uk-women-peace-security-national-action-plan-2023-2027.pdf', target='_blank'>National Action Plan</a> for 2023-2027.</li></ul>","<ul><li>Ethiopia ranked 149 out of 163 countries in the Global Peace Index (2022).</li><li>Ethiopia ranked 98 out of 181 countries in the Corruption Perception Index (2023).</li><li>In the current period of analysis (May 2021) by the <a href='https://data.humdata.org/dataset/global-acute-food-insecurity-country-data', target='_blank'>IPC</a>, 30% of the population of Ethiopia are in IPC Phase 3+ (in food crisis), an estimated 16756345 people. 8% (4331214 people) are estimated to be in Phase 4 (emergency). 352896 (1.0%) are in Phase 5 (catastrophe/famine).</li><li>In Ethiopia there has been a total of 2,852,493 people displaced, with 794,266 new displacements in 2023 [<a href='https://data.humdata.org/dataset/idmc-internal-displacements-new-displacements-idps', target='_blank'>IDMC</a>].</li><li>There are 4 current crises and severity categories listed in the <a href=""https://www.acaps.org/en/thematics/all-topics/inform-severity-index"" target=""_blank"">INFORM Severity Index</a> for Ethiopia: Complex crisis in Ethiopia (Very High), Drought in Ethiopia (Very High), International Displacement (Medium), Northern Ethiopia Conflict (Very High), as of 26/12/24.</li><li>Ethiopia is one of 12 focus countries in the UK's WPS <a href='https://assets.publishing.service.gov.uk/government/uploads/system/uploads/attachment_data/file/1156085/uk-women-peace-security-national-action-plan-2023-2027.pdf', target='_blank'>National Action Plan</a> for 2023-2027.</li></ul>"
pax,France,52.0,FRA,220.0,FR,250.0,FRN,2.0,All,https://pax.peaceagreements.org/tracker/all,https://pax.peaceagreements.org/agreements/search/results?region=&countries=52&name=&match_any_issues=True&text=&search_type=simple,1,1,"<ul><li>The most recent agreement signed in France was <a href=""https://pax.peaceagreements.org/agreements/1887/"" target=""_blank"">Treaty on the Final Settlement with Respect to Germany (four plus two agreement) (12/09/1990)</a>, as part of the Post-WWII Germany normalisation process.</li><li>There has been a total of 1 agreement in France, since the first agreement was signed in 1990 (<a href=""https://pax.peaceagreements.org/agreements/1887/"" target=""_blank"">Treaty on the Final Settlement with Respect to Germany (four plus two agreement) (12/09/1990)</a>), in 1 peace process (Post-WWII Germany normalisation process).</li></ul>",220.0,France,1.0,1.0,0.0,0.0,0.0,0.0,0.0,0.0,0.0,0.0,0.0,0.0,0.0,0.0,0.0,0.0,2024-11-30,250,France,10.0,6612,0.0,191.0,0.0,792.0,4.0,8354,-601.0,0.0,-1742,6.0,-75.88383838383838,0.0,-20.852286329901844,150.0,2025-01-17,65.0,163,France ranked 65 out of 163 countries in the Global Peace Index (2022).,20.0,181,France ranked 20 out of 181 countries in the Corruption Perception Index (2023).,,,,, ,<ul><li>France ranked 65 out of 163 countries in the Global Peace Index (2022).</li><li>France ranked 20 out of 181 countries in the Corruption Perception Index (2023).</li></ul>
pax,Gabon,54.0,GAB,481.0,GA,266.0,GAB,2.0,All,https://pax.peaceagreements.org/tracker/all,https://pax.peaceagreements.org/agreements/search/results?region=&countries=54&name=&match_any_issues=True&text=&search_type=simple,1,1,"<ul><li>The most recent agreement signed in Gabon was <a href=""https://pax.peaceagreements.org/agreements/8/"" target=""_blank"">Accord de Paris (07/10/1994)</a>, as part of the Gabon peace process.</li><li>There has been a total of 1 agreement in Gabon, since the first agreement was signed in 1994 (<a href=""https://pax.peaceagreements.org/agreements/8/"" target=""_blank"">Accord de Paris (07/10/1994)</a>), in 1 peace process (Gabon peace process).</li></ul>",,,,,,,,,,,,,,,,,,,,266,Gabon,1.0,38,1.0,9.0,0.0,5.0,1.0,45,4.0,1.0,-7,0.0,80.0,0.0,-15.555555555555555,0.0,2025-01-17,75.0,163,Gabon ranked 75 out of 163 countries in the Global Peace Index (2022).,136.0,181,Gabon ranked 136 out of 181 countries in the Corruption Perception Index (2023).,,,,, ,<ul><li>Gabon ranked 75 out of 163 countries in the Global Peace Index (2022).</li><li>Gabon ranked 136 out of 181 countries in the Corruption Perception Index (2023).</li></ul>
pax,Georgia,55.0,GEO,372.0,GE,268.0,GRG,2.0,All,https://pax.peaceagreements.org/tracker/all,https://pax.peaceagreements.org/agreements/search/results?region=&countries=55&name=&match_any_issues=True&text=&search_type=simple,64,2,"<ul><li>The most recent agreement signed in Georgia was <a href=""https://pax.peaceagreements.org/agreements/1780/"" target=""_blank"">The Provisional Mechanism for the Prevention and Settlement of Disputes - Technical Arrangements between the Ministry of Internal Affairs of Georgia and the Head of the Mission of the European Union Monitoring Mission (03/11/2008)</a>, as part of the Abkhazia peace process.</li><li>There has been a total of 64 agreements in Georgia, since the first agreement was signed in 1992 (<a href=""https://pax.peaceagreements.org/agreements/1699/"" target=""_blank"">Agreement on Principles of Settlement of the Georgian-Ossetian Conflict (Sochi Agreement) (24/06/1992)</a>), in 2 peace processes (South Ossetia peace process, Abkhazia peace process).</li></ul>",,,,,,,,,,,,,,,,,,,,268,Georgia,1.0,456,1.0,109.0,0.0,130.0,0.0,61,-21.0,1.0,395,1.0,-16.153846153846153,0.0,647.5409836065575,0.0,2025-01-17,95.0,163,Georgia ranked 95 out of 163 countries in the Global Peace Index (2022).,49.0,181,Georgia ranked 49 out of 181 countries in the Corruption Perception Index (2023).,,"In Georgia, there has been a total of 310,872 people displaced as of end of 2023 [<a href='https://data.humdata.org/dataset/idmc-internal-displacements-new-displacements-idps', target='_blank'>IDMC</a>].",,,"<ul><li>In Georgia, there has been a total of 310,872 people displaced as of end of 2023 [<a href='https://data.humdata.org/dataset/idmc-internal-displacements-new-displacements-idps', target='_blank'>IDMC</a>].</li></ul>","<ul><li>Georgia ranked 95 out of 163 countries in the Global Peace Index (2022).</li><li>Georgia ranked 49 out of 181 countries in the Corruption Perception Index (2023).</li><li>In Georgia, there has been a total of 310,872 people displaced as of end of 2023 [<a href='https://data.humdata.org/dataset/idmc-internal-displacements-new-displacements-idps', target='_blank'>IDMC</a>].</li></ul>"
pax,Germany,194.0,DEU,260.0,DE,276.0,GMY,2.0,All,https://pax.peaceagreements.org/tracker/all,https://pax.peaceagreements.org/agreements/search/results?region=&countries=194&name=&match_any_issues=True&text=&search_type=simple,1,1,"<ul><li>The most recent agreement signed in Germany was <a href=""https://pax.peaceagreements.org/agreements/1887/"" target=""_blank"">Treaty on the Final Settlement with Respect to Germany (four plus two agreement) (12/09/1990)</a>, as part of the Post-WWII Germany normalisation process.</li><li>There has been a total of 1 agreement in Germany, since the first agreement was signed in 1990 (<a href=""https://pax.peaceagreements.org/agreements/1887/"" target=""_blank"">Treaty on the Final Settlement with Respect to Germany (four plus two agreement) (12/09/1990)</a>), in 1 peace process (Post-WWII Germany normalisation process).</li></ul>",260.0,Germany,3.0,1.0,0.0,0.0,0.0,0.0,0.0,0.0,0.0,0.0,0.0,0.0,0.0,0.0,0.0,0.0,2024-11-30,276,Germany,13.0,4305,6.0,132.0,0.0,300.0,8.0,4578,-168.0,6.0,-273,5.0,-56.00000000000001,0.0,-5.963302752293578,62.5,2025-01-17,16.0,163,Germany ranked 16 out of 163 countries in the Global Peace Index (2022).,9.0,181,Germany ranked 9 out of 181 countries in the Corruption Perception Index (2023).,,,,, ,<ul><li>Germany ranked 16 out of 163 countries in the Global Peace Index (2022).</li><li>Germany ranked 9 out of 181 countries in the Corruption Perception Index (2023).</li></ul>
pax,Ghana,172.0,GHA,452.0,GH,288.0,GHA,2.0,All,https://pax.peaceagreements.org/tracker/all,https://pax.peaceagreements.org/agreements/search/results?region=&countries=172&name=&match_any_issues=True&text=&search_type=simple,1,1,"<ul><li>The most recent agreement signed in Ghana was <a href=""https://pax.peaceagreements.org/agreements/2487/"" target=""_blank"">Kumasi Accord on Peace and Reconciliation Between the Various Ethnic Groups in the Northern Region of Ghana (30/03/1996)</a>, as part of the Ghana: Local peace processes in Northern Region.</li><li>There has been a total of 1 agreement in Ghana, since the first agreement was signed in 1996 (<a href=""https://pax.peaceagreements.org/agreements/2487/"" target=""_blank"">Kumasi Accord on Peace and Reconciliation Between the Various Ethnic Groups in the Northern Region of Ghana (30/03/1996)</a>), in 1 peace process (Ghana: Local peace processes in Northern Region).</li></ul>",,,,,,,,,,,,,,,,,,,,288,Ghana,158.0,475,14.0,35.0,10.0,81.0,155.0,304,-46.0,4.0,171,3.0,-56.79012345679012,40.0,56.25,1.935483870967742,2025-01-17,40.0,163,Ghana ranked 40 out of 163 countries in the Global Peace Index (2022).,70.0,181,Ghana ranked 70 out of 181 countries in the Corruption Perception Index (2023).,"In the current period of analysis (Mar 2024) by the <a href='https://data.humdata.org/dataset/global-acute-food-insecurity-country-data', target='_blank'>IPC</a>, 4% of the population of Ghana are in IPC Phase 3+ (in food crisis), an estimated 1152381 people. 0% (19868 people) are estimated to be in Phase 4 (emergency).","In Ghana there has been a total of 3,837 people displaced, with 679 new displacements in 2023 [<a href='https://data.humdata.org/dataset/idmc-internal-displacements-new-displacements-idps', target='_blank'>IDMC</a>].",,,"<ul><li>In the current period of analysis (Mar 2024) by the <a href='https://data.humdata.org/dataset/global-acute-food-insecurity-country-data', target='_blank'>IPC</a>, 4% of the population of Ghana are in IPC Phase 3+ (in food crisis), an estimated 1152381 people. 0% (19868 people) are estimated to be in Phase 4 (emergency).</li><li>In Ghana there has been a total of 3,837 people displaced, with 679 new displacements in 2023 [<a href='https://data.humdata.org/dataset/idmc-internal-displacements-new-displacements-idps', target='_blank'>IDMC</a>].</li></ul>","<ul><li>Ghana ranked 40 out of 163 countries in the Global Peace Index (2022).</li><li>Ghana ranked 70 out of 181 countries in the Corruption Perception Index (2023).</li><li>In the current period of analysis (Mar 2024) by the <a href='https://data.humdata.org/dataset/global-acute-food-insecurity-country-data', target='_blank'>IPC</a>, 4% of the population of Ghana are in IPC Phase 3+ (in food crisis), an estimated 1152381 people. 0% (19868 people) are estimated to be in Phase 4 (emergency).</li><li>In Ghana there has been a total of 3,837 people displaced, with 679 new displacements in 2023 [<a href='https://data.humdata.org/dataset/idmc-internal-displacements-new-displacements-idps', target='_blank'>IDMC</a>].</li></ul>"
pax,Guatemala,56.0,GTM,90.0,GT,320.0,GUA,2.0,All,https://pax.peaceagreements.org/tracker/all,https://pax.peaceagreements.org/agreements/search/results?region=&countries=56&name=&match_any_issues=True&text=&search_type=simple,19,2,"<ul><li>The most recent agreement signed in Guatemala was <a href=""https://pax.peaceagreements.org/agreements/254/"" target=""_blank"">Agreement on a Firm and Lasting Peace (29/12/1996)</a>, as part of the Guatemala peace process.</li><li>There has been a total of 19 agreements in Guatemala, since the first agreement was signed in 1990 (<a href=""https://pax.peaceagreements.org/agreements/309/"" target=""_blank"">Basic Agreement for the Search for Peace by Political Means ('Oslo Agreement') (30/03/1990)</a>), in 2 peace processes (Guatemala peace process, Nicaragua contra process).</li></ul>",,,,,,,,,,,,,,,,,,,,320,Guatemala,277.0,343,15.0,21.0,17.0,32.0,819.0,1827,-11.0,-2.0,-1484,-542.0,-34.375,-11.76470588235294,-81.22605363984674,-66.17826617826617,2025-01-17,106.0,163,Guatemala ranked 106 out of 163 countries in the Global Peace Index (2022).,154.0,181,Guatemala ranked 154 out of 181 countries in the Corruption Perception Index (2023).,"In the current period of analysis (Jul 2024) by the <a href='https://data.humdata.org/dataset/global-acute-food-insecurity-country-data', target='_blank'>IPC</a>, 17% of the population of Guatemala are in IPC Phase 3+ (in food crisis), an estimated 2994471 people. 2% (386280 people) are estimated to be in Phase 4 (emergency).","In Guatemala there has been a total of 242,386 people displaced, with 575 new displacements in 2023 [<a href='https://data.humdata.org/dataset/idmc-internal-displacements-new-displacements-idps', target='_blank'>IDMC</a>].","There is 1 current crisis and severity category listed in the <a href=""https://www.acaps.org/en/thematics/all-topics/inform-severity-index"" target=""_blank"">INFORM Severity Index</a> for Guatemala: Complex crisis in Guatemala (High), as of 21/11/24.",,"<ul><li>In the current period of analysis (Jul 2024) by the <a href='https://data.humdata.org/dataset/global-acute-food-insecurity-country-data', target='_blank'>IPC</a>, 17% of the population of Guatemala are in IPC Phase 3+ (in food crisis), an estimated 2994471 people. 2% (386280 people) are estimated to be in Phase 4 (emergency).</li><li>In Guatemala there has been a total of 242,386 people displaced, with 575 new displacements in 2023 [<a href='https://data.humdata.org/dataset/idmc-internal-displacements-new-displacements-idps', target='_blank'>IDMC</a>].</li><li>There is 1 current crisis and severity category listed in the <a href=""https://www.acaps.org/en/thematics/all-topics/inform-severity-index"" target=""_blank"">INFORM Severity Index</a> for Guatemala: Complex crisis in Guatemala (High), as of 21/11/24.</li></ul>","<ul><li>Guatemala ranked 106 out of 163 countries in the Global Peace Index (2022).</li><li>Guatemala ranked 154 out of 181 countries in the Corruption Perception Index (2023).</li><li>In the current period of analysis (Jul 2024) by the <a href='https://data.humdata.org/dataset/global-acute-food-insecurity-country-data', target='_blank'>IPC</a>, 17% of the population of Guatemala are in IPC Phase 3+ (in food crisis), an estimated 2994471 people. 2% (386280 people) are estimated to be in Phase 4 (emergency).</li><li>In Guatemala there has been a total of 242,386 people displaced, with 575 new displacements in 2023 [<a href='https://data.humdata.org/dataset/idmc-internal-displacements-new-displacements-idps', target='_blank'>IDMC</a>].</li><li>There is 1 current crisis and severity category listed in the <a href=""https://www.acaps.org/en/thematics/all-topics/inform-severity-index"" target=""_blank"">INFORM Severity Index</a> for Guatemala: Complex crisis in Guatemala (High), as of 21/11/24.</li></ul>"
