pax,Liberia,76.0,LBR,450.0,LR,430.0,LBR,2.0,All,https://pax.peaceagreements.org/tracker/all,https://pax.peaceagreements.org/agreements/search/results?region=&countries=76&name=&match_any_issues=True&text=&search_type=simple,30,1,"<ul><li>The most recent agreement signed in Liberia was <a href=""https://pax.peaceagreements.org/agreements/338/"" target=""_blank"">Peace Agreement between the Government of Liberia, the Liberians United for Reconciliation and Democracy (LURD), the Movement of Democracy in Liberia (MODEL) and the Political Parties (Accra Agreement) (18/08/2003)</a>, as part of the Liberia peace process.</li><li>There has been a total of 30 agreements in Liberia, since the first agreement was signed in 1990 (<a href=""https://pax.peaceagreements.org/agreements/1305/"" target=""_blank"">Decision A/DEC.1/8/90 on the Ceasefire and Establishment of an ECOWAS Ceasefire Monitoring Group for Liberia (ECOWAS Peace Plan) (07/08/1990)</a>), in 1 peace process (Liberia peace process).</li></ul>",,,,,,,,,,,,,,,,,,,,430,Liberia,6.0,43,2.0,5.0,0.0,11.0,7.0,34,-6.0,2.0,9,-1.0,-54.54545454545454,0.0,26.47058823529412,-14.285714285714285,2025-01-17,75.0,163,Liberia ranked 75 out of 163 countries in the Global Peace Index (2022).,145.0,181,Liberia ranked 145 out of 181 countries in the Corruption Perception Index (2023).,"In the current period of analysis (Oct 2022) by the <a href='https://data.humdata.org/dataset/global-acute-food-insecurity-country-data', target='_blank'>IPC</a>, 8% of the population of Liberia are in IPC Phase 3+ (in food crisis), an estimated 373230 people. 0% (7483 people) are estimated to be in Phase 4 (emergency).",,,,"<ul><li>In the current period of analysis (Oct 2022) by the <a href='https://data.humdata.org/dataset/global-acute-food-insecurity-country-data', target='_blank'>IPC</a>, 8% of the population of Liberia are in IPC Phase 3+ (in food crisis), an estimated 373230 people. 0% (7483 people) are estimated to be in Phase 4 (emergency).</li></ul>","<ul><li>Liberia ranked 75 out of 163 countries in the Global Peace Index (2022).</li><li>Liberia ranked 145 out of 181 countries in the Corruption Perception Index (2023).</li><li>In the current period of analysis (Oct 2022) by the <a href='https://data.humdata.org/dataset/global-acute-food-insecurity-country-data', target='_blank'>IPC</a>, 8% of the population of Liberia are in IPC Phase 3+ (in food crisis), an estimated 373230 people. 0% (7483 people) are estimated to be in Phase 4 (emergency).</li></ul>"
pax,Libya,77.0,LBY,620.0,LY,434.0,LIB,1.0,Libya,https://pax.peaceagreements.org/tracker/libya,https://pax.peaceagreements.org/agreements/search/results?region=&countries=77&name=&match_any_issues=True&text=&search_type=simple,47,4,"<ul><li>The most recent agreement signed in Libya was <a href=""https://pax.peaceagreements.org/agreements/2496/"" target=""_blank"">Charter ""And reconciliation is good"" to support peaceful coexistence among the people of the Arabs of Murzuq and the Tabu in Murzuq (13/12/2022)</a>, as part of the Libyan local processes.</li><li>There has been a total of 47 agreements in Libya, since the first agreement was signed in 1994 (<a href=""https://pax.peaceagreements.org/agreements/237/"" target=""_blank"">Agreement between the Great Socialist People's Libyan Arab Jamahariya and the Rep of Chad concerning the practical modalitities for the implementation of the Judgment delivered by the International Court of Justice on 3 February 1994 (04/04/1994)</a>), in 4 peace processes (Libyan transitional process, Libyan local processes, Libyan peace process, Chad-Libya border peace process).</li></ul>",620.0,Libya,2.0,1.0,0.0,0.0,0.0,0.0,0.0,0.0,0.0,0.0,0.0,0.0,0.0,0.0,0.0,0.0,2024-11-30,434,Libya,148.0,522,6.0,51.0,18.0,41.0,16.0,119,10.0,-12.0,403,132.0,24.390243902439025,-66.66666666666666,338.65546218487395,825.0,2025-01-17,151.0,163,Libya ranked 151 out of 163 countries in the Global Peace Index (2022).,170.0,181,Libya ranked 170 out of 181 countries in the Corruption Perception Index (2023).,,"In Libya there has been a total of 119,275 people displaced, with 1,702 new displacements in 2023 [<a href='https://data.humdata.org/dataset/idmc-internal-displacements-new-displacements-idps', target='_blank'>IDMC</a>].","There are 4 current crises and severity categories listed in the <a href=""https://www.acaps.org/en/thematics/all-topics/inform-severity-index"" target=""_blank"">INFORM Severity Index</a> for Libya: Complex crisis in Libya (High), Mixed migration flows in Libya (High), Refugees from Sudan in Libya (Medium), Storm Daniel and floods in Libya (Medium), as of 19/12/24.","Libya is one of 12 focus countries in the UK's WPS <a href='https://assets.publishing.service.gov.uk/government/uploads/system/uploads/attachment_data/file/1156085/uk-women-peace-security-national-action-plan-2023-2027.pdf', target='_blank'>National Action Plan</a> for 2023-2027. ","<ul><li>In Libya there has been a total of 119,275 people displaced, with 1,702 new displacements in 2023 [<a href='https://data.humdata.org/dataset/idmc-internal-displacements-new-displacements-idps', target='_blank'>IDMC</a>].</li><li>There are 4 current crises and severity categories listed in the <a href=""https://www.acaps.org/en/thematics/all-topics/inform-severity-index"" target=""_blank"">INFORM Severity Index</a> for Libya: Complex crisis in Libya (High), Mixed migration flows in Libya (High), Refugees from Sudan in Libya (Medium), Storm Daniel and floods in Libya (Medium), as of 19/12/24.</li><li>Libya is one of 12 focus countries in the UK's WPS <a href='https://assets.publishing.service.gov.uk/government/uploads/system/uploads/attachment_data/file/1156085/uk-women-peace-security-national-action-plan-2023-2027.pdf', target='_blank'>National Action Plan</a> for 2023-2027.</li></ul>","<ul><li>Libya ranked 151 out of 163 countries in the Global Peace Index (2022).</li><li>Libya ranked 170 out of 181 countries in the Corruption Perception Index (2023).</li><li>In Libya there has been a total of 119,275 people displaced, with 1,702 new displacements in 2023 [<a href='https://data.humdata.org/dataset/idmc-internal-displacements-new-displacements-idps', target='_blank'>IDMC</a>].</li><li>There are 4 current crises and severity categories listed in the <a href=""https://www.acaps.org/en/thematics/all-topics/inform-severity-index"" target=""_blank"">INFORM Severity Index</a> for Libya: Complex crisis in Libya (High), Mixed migration flows in Libya (High), Refugees from Sudan in Libya (Medium), Storm Daniel and floods in Libya (Medium), as of 19/12/24.</li><li>Libya is one of 12 focus countries in the UK's WPS <a href='https://assets.publishing.service.gov.uk/government/uploads/system/uploads/attachment_data/file/1156085/uk-women-peace-security-national-action-plan-2023-2027.pdf', target='_blank'>National Action Plan</a> for 2023-2027.</li></ul>"
pax,Macedonia,78.0,MKD,343.0,MK,807.0,MAC,2.0,All,https://pax.peaceagreements.org/tracker/all,https://pax.peaceagreements.org/agreements/search/results?region=&countries=78&name=&match_any_issues=True&text=&search_type=simple,1,1,"<ul><li>The most recent agreement signed in Macedonia was <a href=""https://pax.peaceagreements.org/agreements/381/"" target=""_blank"">Framework Agreement (The Ohrid Agreement) (13/08/2001)</a>, as part of the Macedonia peace process.</li><li>There has been a total of 1 agreement in Macedonia, since the first agreement was signed in 2001 (<a href=""https://pax.peaceagreements.org/agreements/381/"" target=""_blank"">Framework Agreement (The Ohrid Agreement) (13/08/2001)</a>), in 1 peace process (Macedonia peace process).</li></ul>",,,,,,,,,,,,,,,,,,,,807,North Macedonia,0.0,152,0.0,14.0,0.0,7.0,0.0,78,7.0,0.0,74,0.0,100.0,0.0,94.87179487179486,0.0,2025-01-17,36.0,163,North Macedonia ranked 36 out of 163 countries in the Global Peace Index (2022).,76.0,181,North Macedonia ranked 76 out of 181 countries in the Corruption Perception Index (2023).,,"In North Macedonia, there has been a total of 108 people displaced as of end of 2023 [<a href='https://data.humdata.org/dataset/idmc-internal-displacements-new-displacements-idps', target='_blank'>IDMC</a>].",,,"<ul><li>In North Macedonia, there has been a total of 108 people displaced as of end of 2023 [<a href='https://data.humdata.org/dataset/idmc-internal-displacements-new-displacements-idps', target='_blank'>IDMC</a>].</li></ul>","<ul><li>North Macedonia ranked 36 out of 163 countries in the Global Peace Index (2022).</li><li>North Macedonia ranked 76 out of 181 countries in the Corruption Perception Index (2023).</li><li>In North Macedonia, there has been a total of 108 people displaced as of end of 2023 [<a href='https://data.humdata.org/dataset/idmc-internal-displacements-new-displacements-idps', target='_blank'>IDMC</a>].</li></ul>"
pax,Madagascar,79.0,MDG,580.0,MG,450.0,MAG,2.0,All,https://pax.peaceagreements.org/tracker/all,https://pax.peaceagreements.org/agreements/search/results?region=&countries=79&name=&match_any_issues=True&text=&search_type=simple,11,1,"<ul><li>The most recent agreement signed in Madagascar was <a href=""https://pax.peaceagreements.org/agreements/768/"" target=""_blank"">Roadmap for Ending the Crisis in Madagascar - Commitments by Malagasy Political Stakeholders (13/09/2011)</a>, as part of the Madagascar peace process.</li><li>There has been a total of 11 agreements in Madagascar, since the first agreement was signed in 2002 (<a href=""https://pax.peaceagreements.org/agreements/2048/"" target=""_blank"">Accord (Dakar I) (18/04/2002)</a>), in 1 peace process (Madagascar peace process).</li></ul>",,,,,,,,,,,,,,,,,,,,450,Madagascar,419.0,691,14.0,45.0,17.0,31.0,353.0,540,14.0,-3.0,151,66.0,45.16129032258064,-17.647058823529413,27.962962962962962,18.69688385269122,2025-01-17,84.0,163,Madagascar ranked 84 out of 163 countries in the Global Peace Index (2022).,145.0,181,Madagascar ranked 145 out of 181 countries in the Corruption Perception Index (2023).,"In the current period of analysis (Jun 2024) by the <a href='https://data.humdata.org/dataset/global-acute-food-insecurity-country-data', target='_blank'>IPC</a>, 12% of the population of Madagascar are in IPC Phase 3+ (in food crisis), an estimated 1219583 people.","In Madagascar, there has been a total of 2,807 people displaced as of end of 2023 [<a href='https://data.humdata.org/dataset/idmc-internal-displacements-new-displacements-idps', target='_blank'>IDMC</a>].","There are 4 current crises and severity categories listed in the <a href=""https://www.acaps.org/en/thematics/all-topics/inform-severity-index"" target=""_blank"">INFORM Severity Index</a> for Madagascar: Cyclone Gamane in Madagascar (Medium), Drought in Madagascar (Medium), Multiple crisis in Madagascar (Medium), Tropical cyclone Freddy in Madagascar (Medium), as of 26/12/24.",,"<ul><li>In the current period of analysis (Jun 2024) by the <a href='https://data.humdata.org/dataset/global-acute-food-insecurity-country-data', target='_blank'>IPC</a>, 12% of the population of Madagascar are in IPC Phase 3+ (in food crisis), an estimated 1219583 people.</li><li>In Madagascar, there has been a total of 2,807 people displaced as of end of 2023 [<a href='https://data.humdata.org/dataset/idmc-internal-displacements-new-displacements-idps', target='_blank'>IDMC</a>].</li><li>There are 4 current crises and severity categories listed in the <a href=""https://www.acaps.org/en/thematics/all-topics/inform-severity-index"" target=""_blank"">INFORM Severity Index</a> for Madagascar: Cyclone Gamane in Madagascar (Medium), Drought in Madagascar (Medium), Multiple crisis in Madagascar (Medium), Tropical cyclone Freddy in Madagascar (Medium), as of 26/12/24.</li></ul>","<ul><li>Madagascar ranked 84 out of 163 countries in the Global Peace Index (2022).</li><li>Madagascar ranked 145 out of 181 countries in the Corruption Perception Index (2023).</li><li>In the current period of analysis (Jun 2024) by the <a href='https://data.humdata.org/dataset/global-acute-food-insecurity-country-data', target='_blank'>IPC</a>, 12% of the population of Madagascar are in IPC Phase 3+ (in food crisis), an estimated 1219583 people.</li><li>In Madagascar, there has been a total of 2,807 people displaced as of end of 2023 [<a href='https://data.humdata.org/dataset/idmc-internal-displacements-new-displacements-idps', target='_blank'>IDMC</a>].</li><li>There are 4 current crises and severity categories listed in the <a href=""https://www.acaps.org/en/thematics/all-topics/inform-severity-index"" target=""_blank"">INFORM Severity Index</a> for Madagascar: Cyclone Gamane in Madagascar (Medium), Drought in Madagascar (Medium), Multiple crisis in Madagascar (Medium), Tropical cyclone Freddy in Madagascar (Medium), as of 26/12/24.</li></ul>"
pax,Mali,82.0,MLI,432.0,ML,466.0,MLI,2.0,All,https://pax.peaceagreements.org/tracker/all,https://pax.peaceagreements.org/agreements/search/results?region=&countries=82&name=&match_any_issues=True&text=&search_type=simple,42,3,"<ul><li>The most recent agreement signed in Mali was <a href=""https://pax.peaceagreements.org/agreements/2484/"" target=""_blank"">Accord de Principe de Rome (02/02/2022)</a>, as part of the Mali-Azawad Inter-Azawad peace process.</li><li>There has been a total of 42 agreements in Mali, since the first agreement was signed in 1991 (<a href=""https://pax.peaceagreements.org/agreements/206/"" target=""_blank"">Accord sur la cessation des hostilities entre le Gouvernement de la Republique du Mali d'une part, et le Mouvement Populaire de l'Azaouad et le Front Islamique Arabe d'autre part (Accords de Tamanrasset) (06/01/1991)</a>), in 3 peace processes (Mali-Azawad Inter-Azawad peace process, Mali Local Processes, Mali - Niger: local agreements in border areas).</li></ul>",432.0,Mali,1484.0,385.0,105.0,46.0,0.0,0.0,1695.0,309.0,0.0,0.0,76.0,-211.0,0.0,0.0,24.59546925566343,-12.448377581120944,2024-11-30,466,Mali,3882.0,1839,318.0,129.0,241.0,165.0,3431.0,1656,-36.0,77.0,183,451.0,-21.818181818181817,31.950207468879665,11.05072463768116,13.144855727193239,2025-01-17,150.0,163,Mali ranked 150 out of 163 countries in the Global Peace Index (2022).,136.0,181,Mali ranked 136 out of 181 countries in the Corruption Perception Index (2023).,"In the current period of analysis (Nov 2024) by the <a href='https://data.humdata.org/dataset/global-acute-food-insecurity-country-data', target='_blank'>IPC</a>, 4% of the population of Mali are in IPC Phase 3+ (in food crisis), an estimated 901909 people. 0% (19239 people) are estimated to be in Phase 4 (emergency).","In Mali there has been a total of 344,061 people displaced, with 151,896 new displacements in 2023 [<a href='https://data.humdata.org/dataset/idmc-internal-displacements-new-displacements-idps', target='_blank'>IDMC</a>].","There is 1 current crisis and severity category listed in the <a href=""https://www.acaps.org/en/thematics/all-topics/inform-severity-index"" target=""_blank"">INFORM Severity Index</a> for Mali: Complex crisis in Mali (Very High), as of 27/12/24.",,"<ul><li>In the current period of analysis (Nov 2024) by the <a href='https://data.humdata.org/dataset/global-acute-food-insecurity-country-data', target='_blank'>IPC</a>, 4% of the population of Mali are in IPC Phase 3+ (in food crisis), an estimated 901909 people. 0% (19239 people) are estimated to be in Phase 4 (emergency).</li><li>In Mali there has been a total of 344,061 people displaced, with 151,896 new displacements in 2023 [<a href='https://data.humdata.org/dataset/idmc-internal-displacements-new-displacements-idps', target='_blank'>IDMC</a>].</li><li>There is 1 current crisis and severity category listed in the <a href=""https://www.acaps.org/en/thematics/all-topics/inform-severity-index"" target=""_blank"">INFORM Severity Index</a> for Mali: Complex crisis in Mali (Very High), as of 27/12/24.</li></ul>","<ul><li>Mali ranked 150 out of 163 countries in the Global Peace Index (2022).</li><li>Mali ranked 136 out of 181 countries in the Corruption Perception Index (2023).</li><li>In the current period of analysis (Nov 2024) by the <a href='https://data.humdata.org/dataset/global-acute-food-insecurity-country-data', target='_blank'>IPC</a>, 4% of the population of Mali are in IPC Phase 3+ (in food crisis), an estimated 901909 people. 0% (19239 people) are estimated to be in Phase 4 (emergency).</li><li>In Mali there has been a total of 344,061 people displaced, with 151,896 new displacements in 2023 [<a href='https://data.humdata.org/dataset/idmc-internal-displacements-new-displacements-idps', target='_blank'>IDMC</a>].</li><li>There is 1 current crisis and severity category listed in the <a href=""https://www.acaps.org/en/thematics/all-topics/inform-severity-index"" target=""_blank"">INFORM Severity Index</a> for Mali: Complex crisis in Mali (Very High), as of 27/12/24.</li></ul>"
pax,Mexico,84.0,MEX,70.0,MX,484.0,MEX,2.0,All,https://pax.peaceagreements.org/tracker/all,https://pax.peaceagreements.org/agreements/search/results?region=&countries=84&name=&match_any_issues=True&text=&search_type=simple,6,1,"<ul><li>The most recent agreement signed in Mexico was <a href=""https://pax.peaceagreements.org/agreements/214/"" target=""_blank"">Actions and Measures for Chiapas Joint Commitments and Proposals from the State and Federal Governments, and the EZLN (16/02/1996)</a>, as part of the Mexico-Chiapas peace process.</li><li>There has been a total of 6 agreements in Mexico, since the first agreement was signed in 1995 (<a href=""https://pax.peaceagreements.org/agreements/523/"" target=""_blank"">Protocole sur les principes de négociation en vue d’un accord de paix conclu par le
Gouvernement et l’EZLN (Ejército zapatista de liberación nacional) (11/09/1995)</a>), in 1 peace process (Mexico-Chiapas peace process).</li></ul>",70.0,Mexico,7657.0,2357.0,178.0,137.0,0.0,0.0,3113.0,2269.0,0.0,0.0,88.0,4544.0,0.0,0.0,3.878360511238431,145.96851911339544,2024-11-30,484,Mexico,7940.0,14018,608.0,1002.0,722.0,1304.0,4577.0,8131,-302.0,-114.0,5887,3363.0,-23.159509202453986,-15.789473684210526,72.4019185832001,73.47607603233558,2025-01-17,137.0,163,Mexico ranked 137 out of 163 countries in the Global Peace Index (2022).,126.0,181,Mexico ranked 126 out of 181 countries in the Corruption Perception Index (2023).,,"In Mexico there has been a total of 391,550 people displaced, with 11,041 new displacements in 2023 [<a href='https://data.humdata.org/dataset/idmc-internal-displacements-new-displacements-idps', target='_blank'>IDMC</a>].","There are 3 current crises and severity categories listed in the <a href=""https://www.acaps.org/en/thematics/all-topics/inform-severity-index"" target=""_blank"">INFORM Severity Index</a> for Mexico: Criminal Violence in Mexico (None), Mixed Migration in Mexico (Medium), Multiple crisis in Mexico (Medium), as of 20/11/24.",,"<ul><li>In Mexico there has been a total of 391,550 people displaced, with 11,041 new displacements in 2023 [<a href='https://data.humdata.org/dataset/idmc-internal-displacements-new-displacements-idps', target='_blank'>IDMC</a>].</li><li>There are 3 current crises and severity categories listed in the <a href=""https://www.acaps.org/en/thematics/all-topics/inform-severity-index"" target=""_blank"">INFORM Severity Index</a> for Mexico: Criminal Violence in Mexico (None), Mixed Migration in Mexico (Medium), Multiple crisis in Mexico (Medium), as of 20/11/24.</li></ul>","<ul><li>Mexico ranked 137 out of 163 countries in the Global Peace Index (2022).</li><li>Mexico ranked 126 out of 181 countries in the Corruption Perception Index (2023).</li><li>In Mexico there has been a total of 391,550 people displaced, with 11,041 new displacements in 2023 [<a href='https://data.humdata.org/dataset/idmc-internal-displacements-new-displacements-idps', target='_blank'>IDMC</a>].</li><li>There are 3 current crises and severity categories listed in the <a href=""https://www.acaps.org/en/thematics/all-topics/inform-severity-index"" target=""_blank"">INFORM Severity Index</a> for Mexico: Criminal Violence in Mexico (None), Mixed Migration in Mexico (Medium), Multiple crisis in Mexico (Medium), as of 20/11/24.</li></ul>"
pax,Moldova,87.0,MDA,359.0,MD,498.0,MLD,2.0,All,https://pax.peaceagreements.org/tracker/all,https://pax.peaceagreements.org/agreements/search/results?region=&countries=87&name=&match_any_issues=True&text=&search_type=simple,6,1,"<ul><li>The most recent agreement signed in Moldova was <a href=""https://pax.peaceagreements.org/agreements/1957/"" target=""_blank"">Protocol of the Official Meeting of the Permanent Conference for Political Questions in the Framework of the Negotiating Process on the Transdniestrian Settlement (17/11/2017)</a>, as part of the Moldova Transdniestria process.</li><li>There has been a total of 6 agreements in Moldova, since the first agreement was signed in 1992 (<a href=""https://pax.peaceagreements.org/agreements/1024/"" target=""_blank"">Agreement on the Principles for a Peaceful Settlement of the Armed Conflict in the Dniester Region of the Republic of Moldova (21/07/1992)</a>), in 1 peace process (Moldova Transdniestria process).</li></ul>",,,,,,,,,,,,,,,,,,,,498,Moldova,0.0,200,0.0,10.0,0.0,13.0,0.0,75,-3.0,0.0,125,0.0,-23.076923076923077,0.0,166.66666666666669,0.0,2025-01-17,62.0,163,Moldova ranked 62 out of 163 countries in the Global Peace Index (2022).,76.0,181,Moldova ranked 76 out of 181 countries in the Corruption Perception Index (2023).,,,"There is 1 current crisis and severity category listed in the <a href=""https://www.acaps.org/en/thematics/all-topics/inform-severity-index"" target=""_blank"">INFORM Severity Index</a> for Moldova: DIsplacement from Russia-Ukraine conflict in Moldova (Low), as of 29/12/24.",,"<ul><li>There is 1 current crisis and severity category listed in the <a href=""https://www.acaps.org/en/thematics/all-topics/inform-severity-index"" target=""_blank"">INFORM Severity Index</a> for Moldova: DIsplacement from Russia-Ukraine conflict in Moldova (Low), as of 29/12/24.</li></ul>","<ul><li>Moldova ranked 62 out of 163 countries in the Global Peace Index (2022).</li><li>Moldova ranked 76 out of 181 countries in the Corruption Perception Index (2023).</li><li>There is 1 current crisis and severity category listed in the <a href=""https://www.acaps.org/en/thematics/all-topics/inform-severity-index"" target=""_blank"">INFORM Severity Index</a> for Moldova: DIsplacement from Russia-Ukraine conflict in Moldova (Low), as of 29/12/24.</li></ul>"
pax,Mongolia,180.0,MNG,712.0,MN,496.0,MON,2.0,All,https://pax.peaceagreements.org/tracker/all,https://pax.peaceagreements.org/agreements/search/results?region=&countries=180&name=&match_any_issues=True&text=&search_type=simple,3,1,"<ul><li>The most recent agreement signed in Mongolia was <a href=""https://pax.peaceagreements.org/agreements/1807/"" target=""_blank"">Protocol between the Government of the Russian Federation, the Government of Mongolia, and the Government of the People's Republic of China, describing the eastern junction point of the borders of the three states (24/06/1996)</a>, as part of the Russia-China-Central Asian borders interstate process.</li><li>There has been a total of 3 agreements in Mongolia, since the first agreement was signed in 1994 (<a href=""https://pax.peaceagreements.org/agreements/1809/"" target=""_blank"">Agreement between the Government of the Russian Federation, the Government of the People's Republic of China, and the Government of Mongolia on the determination of the points of junction of the national borders of the three states (27/01/1994)</a>), in 1 peace process (Russia-China-Central Asian borders interstate process).</li></ul>",,,,,,,,,,,,,,,,,,,,496,Mongolia,0.0,63,0.0,12.0,0.0,3.0,0.0,18,9.0,0.0,45,0.0,300.0,0.0,250.0,0.0,2025-01-17,42.0,163,Mongolia ranked 42 out of 163 countries in the Global Peace Index (2022).,121.0,181,Mongolia ranked 121 out of 181 countries in the Corruption Perception Index (2023).,,,"There is 1 current crisis and severity category listed in the <a href=""https://www.acaps.org/en/thematics/all-topics/inform-severity-index"" target=""_blank"">INFORM Severity Index</a> for Mongolia: 2024 Dzud (Medium), as of 25/07/24.",,"<ul><li>There is 1 current crisis and severity category listed in the <a href=""https://www.acaps.org/en/thematics/all-topics/inform-severity-index"" target=""_blank"">INFORM Severity Index</a> for Mongolia: 2024 Dzud (Medium), as of 25/07/24.</li></ul>","<ul><li>Mongolia ranked 42 out of 163 countries in the Global Peace Index (2022).</li><li>Mongolia ranked 121 out of 181 countries in the Corruption Perception Index (2023).</li><li>There is 1 current crisis and severity category listed in the <a href=""https://www.acaps.org/en/thematics/all-topics/inform-severity-index"" target=""_blank"">INFORM Severity Index</a> for Mongolia: 2024 Dzud (Medium), as of 25/07/24.</li></ul>"
