pax,South Africa,125.0,ZAF,560.0,ZA,710.0,SAF,2.0,All,https://pax.peaceagreements.org/tracker/all,https://pax.peaceagreements.org/agreements/search/results?region=&countries=125&name=&match_any_issues=True&text=&search_type=simple,16,3,"<ul><li>The most recent agreement signed in South Africa was <a href=""https://pax.peaceagreements.org/agreements/789/"" target=""_blank"">Peace, Security and Cooperation Framework for the Democratic Republic of the Congo and the region (24/02/2013)</a>, as part of the African Great Lakes: Regional Process.</li><li>There has been a total of 16 agreements in South Africa, since the first agreement was signed in 1990 (<a href=""https://pax.peaceagreements.org/agreements/395/"" target=""_blank"">Groot Schuur Minute (04/05/1990)</a>), in 3 peace processes (South Africa peace process, South Africa - Namibia process, African Great Lakes: Regional Process).</li></ul>",,,,,,,,,,,,,,,,,,,,710,South Africa,236.0,2018,14.0,93.0,24.0,179.0,212.0,1171,-86.0,-10.0,847,24.0,-48.04469273743017,-41.66666666666667,72.33134073441502,11.320754716981133,2025-01-17,118.0,163,South Africa ranked 118 out of 163 countries in the Global Peace Index (2022).,83.0,181,South Africa ranked 83 out of 181 countries in the Corruption Perception Index (2023).,"In the current period of analysis (Oct 2020) by the <a href='https://data.humdata.org/dataset/global-acute-food-insecurity-country-data', target='_blank'>IPC</a>, 16% of the population of South Africa are in IPC Phase 3+ (in food crisis), an estimated 9335159 people. 2% (1160087 people) are estimated to be in Phase 4 (emergency).","In South Africa there has been a total of 621 people displaced, with 621 new displacements in 2023 [<a href='https://data.humdata.org/dataset/idmc-internal-displacements-new-displacements-idps', target='_blank'>IDMC</a>].",,,"<ul><li>In the current period of analysis (Oct 2020) by the <a href='https://data.humdata.org/dataset/global-acute-food-insecurity-country-data', target='_blank'>IPC</a>, 16% of the population of South Africa are in IPC Phase 3+ (in food crisis), an estimated 9335159 people. 2% (1160087 people) are estimated to be in Phase 4 (emergency).</li><li>In South Africa there has been a total of 621 people displaced, with 621 new displacements in 2023 [<a href='https://data.humdata.org/dataset/idmc-internal-displacements-new-displacements-idps', target='_blank'>IDMC</a>].</li></ul>","<ul><li>South Africa ranked 118 out of 163 countries in the Global Peace Index (2022).</li><li>South Africa ranked 83 out of 181 countries in the Corruption Perception Index (2023).</li><li>In the current period of analysis (Oct 2020) by the <a href='https://data.humdata.org/dataset/global-acute-food-insecurity-country-data', target='_blank'>IPC</a>, 16% of the population of South Africa are in IPC Phase 3+ (in food crisis), an estimated 9335159 people. 2% (1160087 people) are estimated to be in Phase 4 (emergency).</li><li>In South Africa there has been a total of 621 people displaced, with 621 new displacements in 2023 [<a href='https://data.humdata.org/dataset/idmc-internal-displacements-new-displacements-idps', target='_blank'>IDMC</a>].</li></ul>"
pax,South Korea,126.0,KOR,732.0,KR,410.0,ROK,2.0,All,https://pax.peaceagreements.org/tracker/all,https://pax.peaceagreements.org/agreements/search/results?region=&countries=126&name=&match_any_issues=True&text=&search_type=simple,7,1,"<ul><li>The most recent agreement signed in South Korea was <a href=""https://pax.peaceagreements.org/agreements/2105/"" target=""_blank"">September 19th Pyongyang Declaration (19/09/2018)</a>, as part of the North Korea - South Korea interstate process.</li><li>There has been a total of 7 agreements in South Korea, since the first agreement was signed in 1991 (<a href=""https://pax.peaceagreements.org/agreements/1232/"" target=""_blank"">Agreement on Reconciliation, Non-Aggression, and Exchanges and Cooperation between South and North Korea (13/12/1991)</a>), in 1 peace process (North Korea - South Korea interstate process).</li></ul>",,,,,,,,,,,,,,,,,,,,410,South Korea,0.0,5463,0.0,466.0,0.0,950.0,0.0,2277,-484.0,0.0,3186,0.0,-50.94736842105263,0.0,139.92094861660078,0.0,2025-01-17,43.0,163,South Korea ranked 43 out of 163 countries in the Global Peace Index (2022).,32.0,181,"Korea, South ranked 32 out of 181 countries in the Corruption Perception Index (2023).",,,,, ,"<ul><li>South Korea ranked 43 out of 163 countries in the Global Peace Index (2022).</li><li>Korea, South ranked 32 out of 181 countries in the Corruption Perception Index (2023).</li></ul>"
pax,South Sudan,127.0,SSD,626.0,SS,728.0,SSD,1.0,South Sudan,https://pax.peaceagreements.org/tracker/south-sudan,https://pax.peaceagreements.org/agreements/search/results?region=&countries=127&name=&match_any_issues=True&text=&search_type=simple,142,8,"<ul><li>The most recent agreement signed in South Sudan was <a href=""https://pax.peaceagreements.org/agreements/2452/"" target=""_blank"">Agreement of Peace Dialogue held between Chiefs and leaders of Bor County (Jonglei State and Gumuruk County (GPAA) from 14-15 November 2022 at Nile beach Hotel, Juba (14/11/2022)</a>, as part of the South Sudan: Post-secession Local agreements.</li><li>There has been a total of 142 agreements in South Sudan, since the first agreement was signed in 1992 (<a href=""https://pax.peaceagreements.org/agreements/1021/"" target=""_blank"">Communique of the Abuja Sudanese Peace Conference (04/06/1992)</a>), in 8 peace processes (Sudanese (North-South) peace process, Kordofan - Blue Nile - Abyei process, South Sudan: Pre-secession Local Peace Processes, North - South Sudan secession process, Darfur-Sudan peace process, South Sudan post-secession process, South Sudan: Post-secession Local agreements, African Great Lakes: Regional Process).</li></ul>",,,,,,,,,,,,,,,,,,,,728,South Sudan,1032.0,540,86.0,44.0,79.0,39.0,822.0,383,5.0,7.0,157,210.0,12.82051282051282,8.860759493670885,40.992167101827675,25.547445255474454,2025-01-17,159.0,163,South Sudan ranked 159 out of 163 countries in the Global Peace Index (2022).,177.0,181,South Sudan ranked 177 out of 181 countries in the Corruption Perception Index (2023).,"In the current period of analysis (Sep 2024) by the <a href='https://data.humdata.org/dataset/global-acute-food-insecurity-country-data', target='_blank'>IPC</a>, 47% of the population of South Sudan are in IPC Phase 3+ (in food crisis), an estimated 6312000 people. 13% (1707000 people) are estimated to be in Phase 4 (emergency). 41000 (0.0%) are in Phase 5 (catastrophe/famine).","In South Sudan there has been a total of 1,121,084 people displaced, with 282,396 new displacements in 2023 [<a href='https://data.humdata.org/dataset/idmc-internal-displacements-new-displacements-idps', target='_blank'>IDMC</a>].","There is 1 current crisis and severity category listed in the <a href=""https://www.acaps.org/en/thematics/all-topics/inform-severity-index"" target=""_blank"">INFORM Severity Index</a> for South Sudan: Complex crisis in South Sudan (Very High), as of 19/12/24.","South Sudan is one of 12 focus countries in the UK's WPS <a href='https://assets.publishing.service.gov.uk/government/uploads/system/uploads/attachment_data/file/1156085/uk-women-peace-security-national-action-plan-2023-2027.pdf', target='_blank'>National Action Plan</a> for 2023-2027. ","<ul><li>In the current period of analysis (Sep 2024) by the <a href='https://data.humdata.org/dataset/global-acute-food-insecurity-country-data', target='_blank'>IPC</a>, 47% of the population of South Sudan are in IPC Phase 3+ (in food crisis), an estimated 6312000 people. 13% (1707000 people) are estimated to be in Phase 4 (emergency). 41000 (0.0%) are in Phase 5 (catastrophe/famine).</li><li>In South Sudan there has been a total of 1,121,084 people displaced, with 282,396 new displacements in 2023 [<a href='https://data.humdata.org/dataset/idmc-internal-displacements-new-displacements-idps', target='_blank'>IDMC</a>].</li><li>There is 1 current crisis and severity category listed in the <a href=""https://www.acaps.org/en/thematics/all-topics/inform-severity-index"" target=""_blank"">INFORM Severity Index</a> for South Sudan: Complex crisis in South Sudan (Very High), as of 19/12/24.</li><li>South Sudan is one of 12 focus countries in the UK's WPS <a href='https://assets.publishing.service.gov.uk/government/uploads/system/uploads/attachment_data/file/1156085/uk-women-peace-security-national-action-plan-2023-2027.pdf', target='_blank'>National Action Plan</a> for 2023-2027.</li></ul>","<ul><li>South Sudan ranked 159 out of 163 countries in the Global Peace Index (2022).</li><li>South Sudan ranked 177 out of 181 countries in the Corruption Perception Index (2023).</li><li>In the current period of analysis (Sep 2024) by the <a href='https://data.humdata.org/dataset/global-acute-food-insecurity-country-data', target='_blank'>IPC</a>, 47% of the population of South Sudan are in IPC Phase 3+ (in food crisis), an estimated 6312000 people. 13% (1707000 people) are estimated to be in Phase 4 (emergency). 41000 (0.0%) are in Phase 5 (catastrophe/famine).</li><li>In South Sudan there has been a total of 1,121,084 people displaced, with 282,396 new displacements in 2023 [<a href='https://data.humdata.org/dataset/idmc-internal-displacements-new-displacements-idps', target='_blank'>IDMC</a>].</li><li>There is 1 current crisis and severity category listed in the <a href=""https://www.acaps.org/en/thematics/all-topics/inform-severity-index"" target=""_blank"">INFORM Severity Index</a> for South Sudan: Complex crisis in South Sudan (Very High), as of 19/12/24.</li><li>South Sudan is one of 12 focus countries in the UK's WPS <a href='https://assets.publishing.service.gov.uk/government/uploads/system/uploads/attachment_data/file/1156085/uk-women-peace-security-national-action-plan-2023-2027.pdf', target='_blank'>National Action Plan</a> for 2023-2027.</li></ul>"
pax,Spain,128.0,ESP,230.0,ES,724.0,SPN,2.0,All,https://pax.peaceagreements.org/tracker/all,https://pax.peaceagreements.org/agreements/search/results?region=&countries=128&name=&match_any_issues=True&text=&search_type=simple,3,1,"<ul><li>The most recent agreement signed in Spain was <a href=""https://pax.peaceagreements.org/agreements/1439/"" target=""_blank"">Basque Ceasefire Statement (01/10/2011)</a>, as part of the Spain - Basque internal process.</li><li>There has been a total of 3 agreements in Spain, since the first agreement was signed in 1998 (<a href=""https://pax.peaceagreements.org/agreements/70/"" target=""_blank"">The Lizarra Declaration (12/09/1998)</a>), in 1 peace process (Spain - Basque internal process).</li></ul>",,,,,,,,,,,,,,,,,,,,724,Spain,0.0,3931,0.0,169.0,0.0,373.0,0.0,3162,-204.0,0.0,769,0.0,-54.6916890080429,0.0,24.320050600885516,0.0,2025-01-17,29.0,163,Spain ranked 29 out of 163 countries in the Global Peace Index (2022).,36.0,181,Spain ranked 36 out of 181 countries in the Corruption Perception Index (2023).,,,"There is 1 current crisis and severity category listed in the <a href=""https://www.acaps.org/en/thematics/all-topics/inform-severity-index"" target=""_blank"">INFORM Severity Index</a> for Spain: Mixed migration flows in Spain (Low), as of 05/12/24.",,"<ul><li>There is 1 current crisis and severity category listed in the <a href=""https://www.acaps.org/en/thematics/all-topics/inform-severity-index"" target=""_blank"">INFORM Severity Index</a> for Spain: Mixed migration flows in Spain (Low), as of 05/12/24.</li></ul>","<ul><li>Spain ranked 29 out of 163 countries in the Global Peace Index (2022).</li><li>Spain ranked 36 out of 181 countries in the Corruption Perception Index (2023).</li><li>There is 1 current crisis and severity category listed in the <a href=""https://www.acaps.org/en/thematics/all-topics/inform-severity-index"" target=""_blank"">INFORM Severity Index</a> for Spain: Mixed migration flows in Spain (Low), as of 05/12/24.</li></ul>"
pax,Sri Lanka,129.0,LKA,780.0,LK,144.0,SRI,2.0,All,https://pax.peaceagreements.org/tracker/all,https://pax.peaceagreements.org/agreements/search/results?region=&countries=129&name=&match_any_issues=True&text=&search_type=simple,25,2,"<ul><li>The most recent agreement signed in Sri Lanka was <a href=""https://pax.peaceagreements.org/agreements/1157/"" target=""_blank"">Statement read out by the Norwegian Facilitator Erik Solheim (24/02/2006)</a>, as part of the Sri Lanka LTTE 2002 onward process.</li><li>There has been a total of 25 agreements in Sri Lanka, since the first agreement was signed in 1995 (<a href=""https://pax.peaceagreements.org/agreements/355/"" target=""_blank"">Declaration of Cessation of Hostilities (05/01/1995)</a>), in 2 peace processes (Sri Lanka Kumaratunga/Devolution Processes, Sri Lanka LTTE 2002 onward process).</li></ul>",,,,,,,,,,,,,,,,,,,,144,Sri Lanka,4.0,771,0.0,44.0,0.0,45.0,6.0,632,-1.0,0.0,139,-2.0,-2.2222222222222223,0.0,21.99367088607595,-33.33333333333333,2025-01-17,90.0,163,Sri Lanka ranked 90 out of 163 countries in the Global Peace Index (2022).,115.0,181,Sri Lanka ranked 115 out of 181 countries in the Corruption Perception Index (2023).,,"In Sri Lanka, there has been a total of 12,201 people displaced as of end of 2023 [<a href='https://data.humdata.org/dataset/idmc-internal-displacements-new-displacements-idps', target='_blank'>IDMC</a>].","There are 6 current crises and severity categories listed in the <a href=""https://www.acaps.org/en/thematics/all-topics/inform-severity-index"" target=""_blank"">INFORM Severity Index</a> for Sri Lanka: 2023 Floods and Monsoon Rain (Low), 2024 Floods and Monsoon Rain (Low), 2024 Inter-monsoon Floods in Sri Lanka (Low), Cyclone Fengal Sri Lanka (Low), Multiple crises in Sri Lanka (Low), Socio-economic crisis in Sri Lanka (Medium), as of 19/12/24.",,"<ul><li>In Sri Lanka, there has been a total of 12,201 people displaced as of end of 2023 [<a href='https://data.humdata.org/dataset/idmc-internal-displacements-new-displacements-idps', target='_blank'>IDMC</a>].</li><li>There are 6 current crises and severity categories listed in the <a href=""https://www.acaps.org/en/thematics/all-topics/inform-severity-index"" target=""_blank"">INFORM Severity Index</a> for Sri Lanka: 2023 Floods and Monsoon Rain (Low), 2024 Floods and Monsoon Rain (Low), 2024 Inter-monsoon Floods in Sri Lanka (Low), Cyclone Fengal Sri Lanka (Low), Multiple crises in Sri Lanka (Low), Socio-economic crisis in Sri Lanka (Medium), as of 19/12/24.</li></ul>","<ul><li>Sri Lanka ranked 90 out of 163 countries in the Global Peace Index (2022).</li><li>Sri Lanka ranked 115 out of 181 countries in the Corruption Perception Index (2023).</li><li>In Sri Lanka, there has been a total of 12,201 people displaced as of end of 2023 [<a href='https://data.humdata.org/dataset/idmc-internal-displacements-new-displacements-idps', target='_blank'>IDMC</a>].</li><li>There are 6 current crises and severity categories listed in the <a href=""https://www.acaps.org/en/thematics/all-topics/inform-severity-index"" target=""_blank"">INFORM Severity Index</a> for Sri Lanka: 2023 Floods and Monsoon Rain (Low), 2024 Floods and Monsoon Rain (Low), 2024 Inter-monsoon Floods in Sri Lanka (Low), Cyclone Fengal Sri Lanka (Low), Multiple crises in Sri Lanka (Low), Socio-economic crisis in Sri Lanka (Medium), as of 19/12/24.</li></ul>"
pax,Sudan,130.0,SDN,625.0,SD,729.0,SUD,1.0,Sudan,https://pax.peaceagreements.org/tracker/sudan,https://pax.peaceagreements.org/agreements/search/results?region=&countries=130&name=&match_any_issues=True&text=&search_type=simple,126,12,"<ul><li>The most recent agreement signed in Sudan was <a href=""https://pax.peaceagreements.org/agreements/2560/"" target=""_blank"">Joint Facilitators Statement From the Kingdom of Saudi Arabia and the United States of America (17/06/2023)</a>, as part of the Sudan Transition Process.</li><li>There has been a total of 126 agreements in Sudan, since the first agreement was signed in 1992 (<a href=""https://pax.peaceagreements.org/agreements/1021/"" target=""_blank"">Communique of the Abuja Sudanese Peace Conference (04/06/1992)</a>), in 12 peace processes (Sudanese (North-South) peace process, Kordofan - Blue Nile - Abyei process, Darfur-Sudan peace process, Eastern Sudanese Peace Process, Sudan Transition Process, Sudan Local Processes, Eritrea-Sudan peace process, South Sudan: Pre-secession Local Peace Processes, Chad-Sudan Agreements, North - South Sudan secession process, CAR - Sudan: local cross-border agreements, African Great Lakes: Regional Process).</li></ul>",625.0,Sudan,4353.0,488.0,733.0,59.0,0.0,0.0,6574.0,266.0,0.0,0.0,222.0,-2221.0,0.0,0.0,83.45864661654136,-33.78460602372984,2024-11-30,729,Sudan,15837.0,6724,1958.0,645.0,1790.0,627.0,13617.0,5177,18.0,168.0,1547,2220.0,2.8708133971291865,9.385474860335195,29.882171141587794,16.303150473672616,2025-01-17,154.0,163,Sudan ranked 154 out of 163 countries in the Global Peace Index (2022).,162.0,181,Sudan ranked 162 out of 181 countries in the Corruption Perception Index (2023).,"In the current period of analysis (Apr 2024) by the <a href='https://data.humdata.org/dataset/global-acute-food-insecurity-country-data', target='_blank'>IPC</a>, 45% of the population of Sudan are in IPC Phase 3+ (in food crisis), an estimated 21311946 people. 14% (6554877 people) are estimated to be in Phase 4 (emergency). 153152 (0.0%) are in Phase 5 (catastrophe/famine).","In Sudan there has been a total of 9,052,822 people displaced, with 6,038,666 new displacements in 2023 [<a href='https://data.humdata.org/dataset/idmc-internal-displacements-new-displacements-idps', target='_blank'>IDMC</a>].","There are 2 current crises and severity categories listed in the <a href=""https://www.acaps.org/en/thematics/all-topics/inform-severity-index"" target=""_blank"">INFORM Severity Index</a> for Sudan: Complex crisis in Sudan (Very High), Refugees in Sudan (High), as of 17/12/24.",,"<ul><li>In the current period of analysis (Apr 2024) by the <a href='https://data.humdata.org/dataset/global-acute-food-insecurity-country-data', target='_blank'>IPC</a>, 45% of the population of Sudan are in IPC Phase 3+ (in food crisis), an estimated 21311946 people. 14% (6554877 people) are estimated to be in Phase 4 (emergency). 153152 (0.0%) are in Phase 5 (catastrophe/famine).</li><li>In Sudan there has been a total of 9,052,822 people displaced, with 6,038,666 new displacements in 2023 [<a href='https://data.humdata.org/dataset/idmc-internal-displacements-new-displacements-idps', target='_blank'>IDMC</a>].</li><li>There are 2 current crises and severity categories listed in the <a href=""https://www.acaps.org/en/thematics/all-topics/inform-severity-index"" target=""_blank"">INFORM Severity Index</a> for Sudan: Complex crisis in Sudan (Very High), Refugees in Sudan (High), as of 17/12/24.</li></ul>","<ul><li>Sudan ranked 154 out of 163 countries in the Global Peace Index (2022).</li><li>Sudan ranked 162 out of 181 countries in the Corruption Perception Index (2023).</li><li>In the current period of analysis (Apr 2024) by the <a href='https://data.humdata.org/dataset/global-acute-food-insecurity-country-data', target='_blank'>IPC</a>, 45% of the population of Sudan are in IPC Phase 3+ (in food crisis), an estimated 21311946 people. 14% (6554877 people) are estimated to be in Phase 4 (emergency). 153152 (0.0%) are in Phase 5 (catastrophe/famine).</li><li>In Sudan there has been a total of 9,052,822 people displaced, with 6,038,666 new displacements in 2023 [<a href='https://data.humdata.org/dataset/idmc-internal-displacements-new-displacements-idps', target='_blank'>IDMC</a>].</li><li>There are 2 current crises and severity categories listed in the <a href=""https://www.acaps.org/en/thematics/all-topics/inform-severity-index"" target=""_blank"">INFORM Severity Index</a> for Sudan: Complex crisis in Sudan (Very High), Refugees in Sudan (High), as of 17/12/24.</li></ul>"
pax,Syria,131.0,SYR,652.0,SY,760.0,SYR,1.0,Syria,https://pax.peaceagreements.org/tracker/syria,https://pax.peaceagreements.org/agreements/search/results?region=&countries=131&name=&match_any_issues=True&text=&search_type=simple,108,4,"<ul><li>The most recent agreement signed in Syria was <a href=""https://pax.peaceagreements.org/agreements/2345/"" target=""_blank"">Agreement between Tahrir al-Sham and operations room Fathbatu (26/06/2020)</a>, as part of the Syrian Local Agreements.</li><li>There has been a total of 108 agreements in Syria, since the first agreement was signed in 1991 (<a href=""https://pax.peaceagreements.org/agreements/1018/"" target=""_blank"">Treaty for Brotherhood, Cooperation and Coordination (22/05/1991)</a>), in 4 peace processes (Syrian peace process, Syrian Local Agreements, Intra-Syrian Process (state/non-state), Lebanon-Syria conflict resolution process).</li></ul>",652.0,Syria,2399.0,892.0,574.0,95.0,0.0,0.0,2026.0,922.0,0.0,0.0,-30.0,373.0,0.0,0.0,-3.2537960954446854,18.410661401776903,2024-11-30,760,Syria,7167.0,15554,990.0,1152.0,1621.0,1971.0,6352.0,13131,-819.0,-631.0,2423,815.0,-41.55251141552511,-38.92658852560148,18.452516944634834,12.830604534005039,2025-01-17,161.0,163,Syria ranked 161 out of 163 countries in the Global Peace Index (2022).,177.0,181,Syria ranked 177 out of 181 countries in the Corruption Perception Index (2023).,,"In Syria there has been a total of 7,248,188 people displaced, with 174,420 new displacements in 2023 [<a href='https://data.humdata.org/dataset/idmc-internal-displacements-new-displacements-idps', target='_blank'>IDMC</a>].","There are 3 current crises and severity categories listed in the <a href=""https://www.acaps.org/en/thematics/all-topics/inform-severity-index"" target=""_blank"">INFORM Severity Index</a> for Syria: Socioeconomic and Conflict Crisis in Syria (Very High), Syrian conflict (Very High), Türkiye / Syria earthquake in Syria (High), as of 24/12/24.","Syria is one of 12 focus countries in the UK's WPS <a href='https://assets.publishing.service.gov.uk/government/uploads/system/uploads/attachment_data/file/1156085/uk-women-peace-security-national-action-plan-2023-2027.pdf', target='_blank'>National Action Plan</a> for 2023-2027. ","<ul><li>In Syria there has been a total of 7,248,188 people displaced, with 174,420 new displacements in 2023 [<a href='https://data.humdata.org/dataset/idmc-internal-displacements-new-displacements-idps', target='_blank'>IDMC</a>].</li><li>There are 3 current crises and severity categories listed in the <a href=""https://www.acaps.org/en/thematics/all-topics/inform-severity-index"" target=""_blank"">INFORM Severity Index</a> for Syria: Socioeconomic and Conflict Crisis in Syria (Very High), Syrian conflict (Very High), Türkiye / Syria earthquake in Syria (High), as of 24/12/24.</li><li>Syria is one of 12 focus countries in the UK's WPS <a href='https://assets.publishing.service.gov.uk/government/uploads/system/uploads/attachment_data/file/1156085/uk-women-peace-security-national-action-plan-2023-2027.pdf', target='_blank'>National Action Plan</a> for 2023-2027.</li></ul>","<ul><li>Syria ranked 161 out of 163 countries in the Global Peace Index (2022).</li><li>Syria ranked 177 out of 181 countries in the Corruption Perception Index (2023).</li><li>In Syria there has been a total of 7,248,188 people displaced, with 174,420 new displacements in 2023 [<a href='https://data.humdata.org/dataset/idmc-internal-displacements-new-displacements-idps', target='_blank'>IDMC</a>].</li><li>There are 3 current crises and severity categories listed in the <a href=""https://www.acaps.org/en/thematics/all-topics/inform-severity-index"" target=""_blank"">INFORM Severity Index</a> for Syria: Socioeconomic and Conflict Crisis in Syria (Very High), Syrian conflict (Very High), Türkiye / Syria earthquake in Syria (High), as of 24/12/24.</li><li>Syria is one of 12 focus countries in the UK's WPS <a href='https://assets.publishing.service.gov.uk/government/uploads/system/uploads/attachment_data/file/1156085/uk-women-peace-security-national-action-plan-2023-2027.pdf', target='_blank'>National Action Plan</a> for 2023-2027.</li></ul>"
