con_type,name,id,iso_code,gwno,iso2c,iso_n,gwc,Tracker,tracker_country,tracker_url,search_pax,total_agreements,unique_processes,peace_process_text,ucdp_country_id,ucdp_country,ucdp_fatalities_last_12,ucdp_events_last_12,ucdp_fatalities_last_month,ucdp_events_last_month,ucdp_fatalities_prev_month,ucdp_events_prev_month,ucdp_fatalities_prev_12_months,ucdp_events_prev_12_months,ucdp_change_in_events_last_month,ucdp_change_in_fatalities_last_month,ucdp_change_in_events_last_12_months,ucdp_change_in_fatalities_last_12_months,ucdp_percent_change_in_events_last_month,ucdp_percent_change_in_fatalities_last_month,ucdp_percent_change_in_events_last_12_months,ucdp_percent_change_in_fatalities_last_12_months,ucdp_last_updated,acled_iso,acled_country,acled_fatalities_last_12,acled_events_last_12,acled_fatalities_last_month,acled_events_last_month,acled_fatalities_prev_month,acled_events_prev_month,acled_fatalities_prev_12_months,acled_events_prev_12_months,acled_change_in_events_last_month,acled_change_in_fatalities_last_month,acled_change_in_events_last_12_months,acled_change_in_fatalities_last_12_months,acled_percent_change_in_events_last_month,acled_percent_change_in_fatalities_last_month,acled_percent_change_in_events_last_12_months,acled_percent_change_in_fatalities_last_12_months,acled_last_updated,gpi_rank_value,gpi_total_con,gpi_summary,cpi_rank_value,cpi_total_con,cpi_summary,ipc_summary,idmc_summary,inform_summary,nap_summary,sm_general_updates,general_updates
pax,Afghanistan,5.0,AFG,700.0,AF,4.0,AFG,1.0,Afghanistan,https://pax.peaceagreements.org/tracker/afghanistan,https://pax.peaceagreements.org/agreements/search/results?region=&countries=5&name=&match_any_issues=True&text=&search_type=simple,25,3,"<ul><li>The most recent agreement signed in Afghanistan was <a href=""https://pax.peaceagreements.org/agreements/2271/"" target=""_blank"">Agreement for Bringing Peace to Afghanistan between the Islamic Emirate of Afghanistan which is not recognized by the United States as a state and is known as the Taliban and the United States of America (29/02/2020)</a>, as part of the Afghanistan: 2000s Post-intervention process.</li><li>There has been a total of 25 agreements in Afghanistan, since the first agreement was signed in 1992 (<a href=""https://pax.peaceagreements.org/agreements/482/"" target=""_blank"">Peshawar Accord (24/04/1992)</a>), in 3 peace processes (Afghanistan: 1990s Taliban process, Afghanistan: 2000s Post-intervention process, Afghanistan Islamic-Emirates-intra-Afghan).</li></ul>",700.0,Afghanistan,202.0,68.0,15.0,5.0,0.0,0.0,305.0,159.0,0.0,0.0,-91.0,-103.0,0.0,0.0,-57.23270440251572,-33.77049180327869,2024-11-30,4,Afghanistan,1260.0,1208,94.0,101.0,84.0,101.0,780.0,992,0.0,10.0,216,480.0,0.0,11.904761904761903,21.774193548387096,61.53846153846154,2025-01-17,163.0,163,Afghanistan ranked 163 out of 163 countries in the Global Peace Index (2022).,162.0,181,Afghanistan ranked 162 out of 181 countries in the Corruption Perception Index (2023).,"In the current period of analysis (Oct 2024) by the <a href='https://data.humdata.org/dataset/global-acute-food-insecurity-country-data', target='_blank'>IPC</a>, 25% of the population of Afghanistan are in IPC Phase 3+ (in food crisis), an estimated 11610606 people. 4% (1811656 people) are estimated to be in Phase 4 (emergency).","In Afghanistan, there has been a total of 4,186,882 people displaced as of end of 2023 [<a href='https://data.humdata.org/dataset/idmc-internal-displacements-new-displacements-idps', target='_blank'>IDMC</a>].","There are 2 current crises and severity categories listed in the <a href=""https://www.acaps.org/en/thematics/all-topics/inform-severity-index"" target=""_blank"">INFORM Severity Index</a> for Afghanistan: Complex crisis in Afghanistan (Very High), Earthquake in Herat Province (Medium), as of 12/12/24.","Afghanistan is one of 12 focus countries in the UK's WPS <a href='https://assets.publishing.service.gov.uk/government/uploads/system/uploads/attachment_data/file/1156085/uk-women-peace-security-national-action-plan-2023-2027.pdf', target='_blank'>National Action Plan</a> for 2023-2027. ","<ul><li>In the current period of analysis (Oct 2024) by the <a href='https://data.humdata.org/dataset/global-acute-food-insecurity-country-data', target='_blank'>IPC</a>, 25% of the population of Afghanistan are in IPC Phase 3+ (in food crisis), an estimated 11610606 people. 4% (1811656 people) are estimated to be in Phase 4 (emergency).</li><li>In Afghanistan, there has been a total of 4,186,882 people displaced as of end of 2023 [<a href='https://data.humdata.org/dataset/idmc-internal-displacements-new-displacements-idps', target='_blank'>IDMC</a>].</li><li>There are 2 current crises and severity categories listed in the <a href=""https://www.acaps.org/en/thematics/all-topics/inform-severity-index"" target=""_blank"">INFORM Severity Index</a> for Afghanistan: Complex crisis in Afghanistan (Very High), Earthquake in Herat Province (Medium), as of 12/12/24.</li><li>Afghanistan is one of 12 focus countries in the UK's WPS <a href='https://assets.publishing.service.gov.uk/government/uploads/system/uploads/attachment_data/file/1156085/uk-women-peace-security-national-action-plan-2023-2027.pdf', target='_blank'>National Action Plan</a> for 2023-2027.</li></ul>","<ul><li>Afghanistan ranked 163 out of 163 countries in the Global Peace Index (2022).</li><li>Afghanistan ranked 162 out of 181 countries in the Corruption Perception Index (2023).</li><li>In the current period of analysis (Oct 2024) by the <a href='https://data.humdata.org/dataset/global-acute-food-insecurity-country-data', target='_blank'>IPC</a>, 25% of the population of Afghanistan are in IPC Phase 3+ (in food crisis), an estimated 11610606 people. 4% (1811656 people) are estimated to be in Phase 4 (emergency).</li><li>In Afghanistan, there has been a total of 4,186,882 people displaced as of end of 2023 [<a href='https://data.humdata.org/dataset/idmc-internal-displacements-new-displacements-idps', target='_blank'>IDMC</a>].</li><li>There are 2 current crises and severity categories listed in the <a href=""https://www.acaps.org/en/thematics/all-topics/inform-severity-index"" target=""_blank"">INFORM Severity Index</a> for Afghanistan: Complex crisis in Afghanistan (Very High), Earthquake in Herat Province (Medium), as of 12/12/24.</li><li>Afghanistan is one of 12 focus countries in the UK's WPS <a href='https://assets.publishing.service.gov.uk/government/uploads/system/uploads/attachment_data/file/1156085/uk-women-peace-security-national-action-plan-2023-2027.pdf', target='_blank'>National Action Plan</a> for 2023-2027.</li></ul>"
pax,Algeria,8.0,DZA,615.0,DZ,12.0,ALG,2.0,All,https://pax.peaceagreements.org/tracker/all,https://pax.peaceagreements.org/agreements/search/results?region=&countries=8&name=&match_any_issues=True&text=&search_type=simple,6,1,"<ul><li>The most recent agreement signed in Algeria was <a href=""https://pax.peaceagreements.org/agreements/1595/"" target=""_blank"">Project de charte pour la paix et la réconciliation nationale (14/08/2005)</a>, as part of the Algeria: Bouteflika Process.</li><li>There has been a total of 6 agreements in Algeria, since the first agreement was signed in 1994 (<a href=""https://pax.peaceagreements.org/agreements/484/"" target=""_blank"">Plate-forme portant consensus national sur la période transitoire (26/01/1994)</a>), in 1 peace process (Algeria: Bouteflika Process).</li></ul>",,,,,,,,,,,,,,,,,,,,12,Algeria,34.0,132,0.0,11.0,4.0,14.0,8.0,145,-3.0,-4.0,-13,26.0,-21.428571428571427,-100.0,-8.96551724137931,325.0,2025-01-17,109.0,163,Algeria ranked 109 out of 163 countries in the Global Peace Index (2022).,104.0,181,Algeria ranked 104 out of 181 countries in the Corruption Perception Index (2023).,,,"There are 3 current crises and severity categories listed in the <a href=""https://www.acaps.org/en/thematics/all-topics/inform-severity-index"" target=""_blank"">INFORM Severity Index</a> for Algeria: Mixed migration flows in Algeria (Medium), Multiple crises in Algeria (Medium), Sahrawi refugees in Algeria (Medium), as of 19/12/24.",,"<ul><li>There are 3 current crises and severity categories listed in the <a href=""https://www.acaps.org/en/thematics/all-topics/inform-severity-index"" target=""_blank"">INFORM Severity Index</a> for Algeria: Mixed migration flows in Algeria (Medium), Multiple crises in Algeria (Medium), Sahrawi refugees in Algeria (Medium), as of 19/12/24.</li></ul>","<ul><li>Algeria ranked 109 out of 163 countries in the Global Peace Index (2022).</li><li>Algeria ranked 104 out of 181 countries in the Corruption Perception Index (2023).</li><li>There are 3 current crises and severity categories listed in the <a href=""https://www.acaps.org/en/thematics/all-topics/inform-severity-index"" target=""_blank"">INFORM Severity Index</a> for Algeria: Mixed migration flows in Algeria (Medium), Multiple crises in Algeria (Medium), Sahrawi refugees in Algeria (Medium), as of 19/12/24.</li></ul>"
pax,Angola,9.0,AGO,540.0,AO,24.0,ANG,2.0,All,https://pax.peaceagreements.org/tracker/all,https://pax.peaceagreements.org/agreements/search/results?region=&countries=9&name=&match_any_issues=True&text=&search_type=simple,17,3,"<ul><li>The most recent agreement signed in Angola was <a href=""https://pax.peaceagreements.org/agreements/789/"" target=""_blank"">Peace, Security and Cooperation Framework for the Democratic Republic of the Congo and the region (24/02/2013)</a>, as part of the African Great Lakes: Regional Process.</li><li>There has been a total of 17 agreements in Angola, since the first agreement was signed in 1991 (<a href=""https://pax.peaceagreements.org/agreements/207/"" target=""_blank"">Peace Accords for Angola, Lisbon ('Bicesse Accords') (31/05/1991)</a>), in 3 peace processes (Angola: UNITA process, African Great Lakes: Regional Process, Cabinda process).</li></ul>",,,,,,,,,,,,,,,,,,,,24,Angola,108.0,103,0.0,2.0,0.0,6.0,55.0,78,-4.0,0.0,25,53.0,-66.66666666666666,0.0,32.05128205128205,96.36363636363636,2025-01-17,78.0,163,Angola ranked 78 out of 163 countries in the Global Peace Index (2022).,121.0,181,Angola ranked 121 out of 181 countries in the Corruption Perception Index (2023).,"In the current period of analysis (Jun 2021) by the <a href='https://data.humdata.org/dataset/global-acute-food-insecurity-country-data', target='_blank'>IPC</a>, 49% of the population of Angola are in IPC Phase 3+ (in food crisis), an estimated 1315532 people. 12% (307288 people) are estimated to be in Phase 4 (emergency).",,"There is 1 current crisis and severity category listed in the <a href=""https://www.acaps.org/en/thematics/all-topics/inform-severity-index"" target=""_blank"">INFORM Severity Index</a> for Angola: Drought in South-West Angola (Medium), as of 27/12/24.",,"<ul><li>In the current period of analysis (Jun 2021) by the <a href='https://data.humdata.org/dataset/global-acute-food-insecurity-country-data', target='_blank'>IPC</a>, 49% of the population of Angola are in IPC Phase 3+ (in food crisis), an estimated 1315532 people. 12% (307288 people) are estimated to be in Phase 4 (emergency).</li><li>There is 1 current crisis and severity category listed in the <a href=""https://www.acaps.org/en/thematics/all-topics/inform-severity-index"" target=""_blank"">INFORM Severity Index</a> for Angola: Drought in South-West Angola (Medium), as of 27/12/24.</li></ul>","<ul><li>Angola ranked 78 out of 163 countries in the Global Peace Index (2022).</li><li>Angola ranked 121 out of 181 countries in the Corruption Perception Index (2023).</li><li>In the current period of analysis (Jun 2021) by the <a href='https://data.humdata.org/dataset/global-acute-food-insecurity-country-data', target='_blank'>IPC</a>, 49% of the population of Angola are in IPC Phase 3+ (in food crisis), an estimated 1315532 people. 12% (307288 people) are estimated to be in Phase 4 (emergency).</li><li>There is 1 current crisis and severity category listed in the <a href=""https://www.acaps.org/en/thematics/all-topics/inform-severity-index"" target=""_blank"">INFORM Severity Index</a> for Angola: Drought in South-West Angola (Medium), as of 27/12/24.</li></ul>"
pax,Argentina,11.0,ARG,160.0,AR,32.0,ARG,2.0,All,https://pax.peaceagreements.org/tracker/all,https://pax.peaceagreements.org/agreements/search/results?region=&countries=11&name=&match_any_issues=True&text=&search_type=simple,2,1,"<ul><li>The most recent agreement signed in Argentina was <a href=""https://pax.peaceagreements.org/agreements/423/"" target=""_blank"">Joint Declaration on Cooperation over Offshore Activities in the South West Atlantic (27/09/1995)</a>, as part of the Argentina-UK: Falklands process.</li><li>There has been a total of 2 agreements in Argentina, since the first agreement was signed in 1990 (<a href=""https://pax.peaceagreements.org/agreements/431/"" target=""_blank"">Joint Statement of Confidence-Building Measures, including an Information and Consultation System and Safety Measures for Air and Maritime Navigation (15/02/1990)</a>), in 1 peace process (Argentina-UK: Falklands process).</li></ul>",,,,,,,,,,,,,,,,,,,,32,Argentina,3.0,1462,0.0,79.0,0.0,102.0,4.0,990,-23.0,0.0,472,-1.0,-22.54901960784314,0.0,47.67676767676768,-25.0,2025-01-17,69.0,163,Argentina ranked 69 out of 163 countries in the Global Peace Index (2022).,98.0,181,Argentina ranked 98 out of 181 countries in the Corruption Perception Index (2023).,,,,, ,<ul><li>Argentina ranked 69 out of 163 countries in the Global Peace Index (2022).</li><li>Argentina ranked 98 out of 181 countries in the Corruption Perception Index (2023).</li></ul>
pax,Armenia,12.0,ARM,371.0,AM,51.0,ARM,2.0,All,https://pax.peaceagreements.org/tracker/all,https://pax.peaceagreements.org/agreements/search/results?region=&countries=12&name=&match_any_issues=True&text=&search_type=simple,31,3,"<ul><li>The most recent agreement signed in Armenia was <a href=""https://pax.peaceagreements.org/agreements/2454/"" target=""_blank"">Trilateral Statement of the leaders of Azerbaijan, Russian
Federation and Armenia (31/10/2022)</a>, as part of the Armenia-Azerbaijan-Nagorno Karabakh: OSCE Minsk Process.</li><li>There has been a total of 31 agreements in Armenia, since the first agreement was signed in 1991 (<a href=""https://pax.peaceagreements.org/agreements/611/"" target=""_blank"">Zheleznovodsk Declaration (23/09/1991)</a>), in 3 peace processes (Armenia-Azerbaijan-Nagorno Karabakh: Process 1990s, Armenia-Azerbaijan-Nagorno Karabakh: OSCE Minsk Process, Armenia-Azerbaijan-Nagorno Karabakh: Process 2020).</li></ul>",371.0,Armenia,1.0,1.0,0.0,0.0,0.0,0.0,19.0,9.0,0.0,0.0,-8.0,-18.0,0.0,0.0,-88.88888888888889,-94.73684210526315,2024-11-30,51,Armenia,4.0,373,0.0,9.0,0.0,15.0,13.0,342,-6.0,0.0,31,-9.0,-40.0,0.0,9.064327485380117,-69.23076923076923,2025-01-17,83.0,163,Armenia ranked 83 out of 163 countries in the Global Peace Index (2022).,62.0,181,Armenia ranked 62 out of 181 countries in the Corruption Perception Index (2023).,,"In Armenia, there has been a total of 7,600 people displaced as of end of 2023 [<a href='https://data.humdata.org/dataset/idmc-internal-displacements-new-displacements-idps', target='_blank'>IDMC</a>].","There are 2 current crises and severity categories listed in the <a href=""https://www.acaps.org/en/thematics/all-topics/inform-severity-index"" target=""_blank"">INFORM Severity Index</a> for Armenia: Nagorno-Karabakh Conflict in Armenia (Medium), Refugees from Nagorno-Karabakh in Armenia (Medium), as of 24/12/24.",,"<ul><li>In Armenia, there has been a total of 7,600 people displaced as of end of 2023 [<a href='https://data.humdata.org/dataset/idmc-internal-displacements-new-displacements-idps', target='_blank'>IDMC</a>].</li><li>There are 2 current crises and severity categories listed in the <a href=""https://www.acaps.org/en/thematics/all-topics/inform-severity-index"" target=""_blank"">INFORM Severity Index</a> for Armenia: Nagorno-Karabakh Conflict in Armenia (Medium), Refugees from Nagorno-Karabakh in Armenia (Medium), as of 24/12/24.</li></ul>","<ul><li>Armenia ranked 83 out of 163 countries in the Global Peace Index (2022).</li><li>Armenia ranked 62 out of 181 countries in the Corruption Perception Index (2023).</li><li>In Armenia, there has been a total of 7,600 people displaced as of end of 2023 [<a href='https://data.humdata.org/dataset/idmc-internal-displacements-new-displacements-idps', target='_blank'>IDMC</a>].</li><li>There are 2 current crises and severity categories listed in the <a href=""https://www.acaps.org/en/thematics/all-topics/inform-severity-index"" target=""_blank"">INFORM Severity Index</a> for Armenia: Nagorno-Karabakh Conflict in Armenia (Medium), Refugees from Nagorno-Karabakh in Armenia (Medium), as of 24/12/24.</li></ul>"
pax,Azerbaijan,16.0,AZE,373.0,AZ,31.0,AZE,2.0,All,https://pax.peaceagreements.org/tracker/all,https://pax.peaceagreements.org/agreements/search/results?region=&countries=16&name=&match_any_issues=True&text=&search_type=simple,31,3,"<ul><li>The most recent agreement signed in Azerbaijan was <a href=""https://pax.peaceagreements.org/agreements/2454/"" target=""_blank"">Trilateral Statement of the leaders of Azerbaijan, Russian
Federation and Armenia (31/10/2022)</a>, as part of the Armenia-Azerbaijan-Nagorno Karabakh: OSCE Minsk Process.</li><li>There has been a total of 31 agreements in Azerbaijan, since the first agreement was signed in 1991 (<a href=""https://pax.peaceagreements.org/agreements/611/"" target=""_blank"">Zheleznovodsk Declaration (23/09/1991)</a>), in 3 peace processes (Armenia-Azerbaijan-Nagorno Karabakh: Process 1990s, Armenia-Azerbaijan-Nagorno Karabakh: OSCE Minsk Process, Armenia-Azerbaijan-Nagorno Karabakh: Process 2020).</li></ul>",,,,,,,,,,,,,,,,,,,,31,Azerbaijan,2.0,157,0.0,6.0,0.0,3.0,566.0,739,3.0,0.0,-582,-564.0,100.0,0.0,-78.75507442489851,-99.64664310954063,2025-01-17,128.0,163,Azerbaijan ranked 128 out of 163 countries in the Global Peace Index (2022).,154.0,181,Azerbaijan ranked 154 out of 181 countries in the Corruption Perception Index (2023).,,"In Azerbaijan there has been a total of 657,749 people displaced, with 5,070 new displacements in 2023 [<a href='https://data.humdata.org/dataset/idmc-internal-displacements-new-displacements-idps', target='_blank'>IDMC</a>].","There is 1 current crisis and severity category listed in the <a href=""https://www.acaps.org/en/thematics/all-topics/inform-severity-index"" target=""_blank"">INFORM Severity Index</a> for Azerbaijan: Nagorno-Karabakh conflict in Azerbaijan (Low), as of 25/09/24.",,"<ul><li>In Azerbaijan there has been a total of 657,749 people displaced, with 5,070 new displacements in 2023 [<a href='https://data.humdata.org/dataset/idmc-internal-displacements-new-displacements-idps', target='_blank'>IDMC</a>].</li><li>There is 1 current crisis and severity category listed in the <a href=""https://www.acaps.org/en/thematics/all-topics/inform-severity-index"" target=""_blank"">INFORM Severity Index</a> for Azerbaijan: Nagorno-Karabakh conflict in Azerbaijan (Low), as of 25/09/24.</li></ul>","<ul><li>Azerbaijan ranked 128 out of 163 countries in the Global Peace Index (2022).</li><li>Azerbaijan ranked 154 out of 181 countries in the Corruption Perception Index (2023).</li><li>In Azerbaijan there has been a total of 657,749 people displaced, with 5,070 new displacements in 2023 [<a href='https://data.humdata.org/dataset/idmc-internal-displacements-new-displacements-idps', target='_blank'>IDMC</a>].</li><li>There is 1 current crisis and severity category listed in the <a href=""https://www.acaps.org/en/thematics/all-topics/inform-severity-index"" target=""_blank"">INFORM Severity Index</a> for Azerbaijan: Nagorno-Karabakh conflict in Azerbaijan (Low), as of 25/09/24.</li></ul>"
pax,Bahrain,161.0,BHR,692.0,BH,48.0,BAH,2.0,All,https://pax.peaceagreements.org/tracker/all,https://pax.peaceagreements.org/agreements/search/results?region=&countries=161&name=&match_any_issues=True&text=&search_type=simple,5,1,"<ul><li>The most recent agreement signed in Bahrain was <a href=""https://pax.peaceagreements.org/agreements/1412/"" target=""_blank"">His Majesty Delivers a Speech to Citizens Concerning Request to Amend Some Articles of the Constitution, 15 January 2012 (15/01/2012)</a>, as part of the Bahrain: Reform-based peace process.</li><li>There has been a total of 5 agreements in Bahrain, since the first agreement was signed in 2001 (<a href=""https://pax.peaceagreements.org/agreements/1437/"" target=""_blank"">National Action Charter of Bahrain (15/02/2001)</a>), in 1 peace process (Bahrain: Reform-based peace process).</li></ul>",,,,,,,,,,,,,,,,,,,,48,Bahrain,0.0,841,0.0,73.0,0.0,107.0,0.0,690,-34.0,0.0,151,0.0,-31.775700934579437,0.0,21.884057971014492,0.0,2025-01-17,99.0,163,Bahrain ranked 99 out of 163 countries in the Global Peace Index (2022).,76.0,181,Bahrain ranked 76 out of 181 countries in the Corruption Perception Index (2023).,,,,, ,<ul><li>Bahrain ranked 99 out of 163 countries in the Global Peace Index (2022).</li><li>Bahrain ranked 76 out of 181 countries in the Corruption Perception Index (2023).</li></ul>
pax,Bangladesh,17.0,BGD,771.0,BD,50.0,BNG,2.0,All,https://pax.peaceagreements.org/tracker/all,https://pax.peaceagreements.org/agreements/search/results?region=&countries=17&name=&match_any_issues=True&text=&search_type=simple,1,1,"<ul><li>The most recent agreement signed in Bangladesh was <a href=""https://pax.peaceagreements.org/agreements/238/"" target=""_blank"">Agreement between the National Committee on Chittagong Hill Tracts Constituted by the Government and The Parbattya Chattagram Janasanghati Samity (02/12/1997)</a>, as part of the Bangladesh-Chittagong Hills Tracts: peace process.</li><li>There has been a total of 1 agreement in Bangladesh, since the first agreement was signed in 1997 (<a href=""https://pax.peaceagreements.org/agreements/238/"" target=""_blank"">Agreement between the National Committee on Chittagong Hill Tracts Constituted by the Government and The Parbattya Chattagram Janasanghati Samity (02/12/1997)</a>), in 1 peace process (Bangladesh-Chittagong Hills Tracts: peace process).</li></ul>",771.0,Bangladesh,355.0,40.0,0.0,0.0,0.0,0.0,0.0,0.0,0.0,0.0,0.0,0.0,0.0,0.0,0.0,0.0,2024-11-30,50,Bangladesh,891.0,3398,33.0,297.0,29.0,318.0,268.0,2278,-21.0,4.0,1120,623.0,-6.60377358490566,13.793103448275861,49.16593503072871,232.46268656716418,2025-01-17,96.0,163,Bangladesh ranked 96 out of 163 countries in the Global Peace Index (2022).,149.0,181,Bangladesh ranked 149 out of 181 countries in the Corruption Perception Index (2023).,"In the current period of analysis (Feb 2024) by the <a href='https://data.humdata.org/dataset/global-acute-food-insecurity-country-data', target='_blank'>IPC</a>, 20% of the population of Bangladesh are in IPC Phase 3+ (in food crisis), an estimated 14581885 people. 1% (327747 people) are estimated to be in Phase 4 (emergency).","In Bangladesh, there has been a total of 426,280 people displaced as of end of 2023 [<a href='https://data.humdata.org/dataset/idmc-internal-displacements-new-displacements-idps', target='_blank'>IDMC</a>].","There are 6 current crises and severity categories listed in the <a href=""https://www.acaps.org/en/thematics/all-topics/inform-severity-index"" target=""_blank"">INFORM Severity Index</a> for Bangladesh: 2024 Monsoon Floods in Bangladesh (High), Chronic Food Security Crisis in Bangladesh (High), Complex crisis in Bangladesh (High), Cyclone Remal (Medium), Mutliple crises in Bangladesh (High), Rohingya refugee crisis (High), as of 23/12/24.",,"<ul><li>In the current period of analysis (Feb 2024) by the <a href='https://data.humdata.org/dataset/global-acute-food-insecurity-country-data', target='_blank'>IPC</a>, 20% of the population of Bangladesh are in IPC Phase 3+ (in food crisis), an estimated 14581885 people. 1% (327747 people) are estimated to be in Phase 4 (emergency).</li><li>In Bangladesh, there has been a total of 426,280 people displaced as of end of 2023 [<a href='https://data.humdata.org/dataset/idmc-internal-displacements-new-displacements-idps', target='_blank'>IDMC</a>].</li><li>There are 6 current crises and severity categories listed in the <a href=""https://www.acaps.org/en/thematics/all-topics/inform-severity-index"" target=""_blank"">INFORM Severity Index</a> for Bangladesh: 2024 Monsoon Floods in Bangladesh (High), Chronic Food Security Crisis in Bangladesh (High), Complex crisis in Bangladesh (High), Cyclone Remal (Medium), Mutliple crises in Bangladesh (High), Rohingya refugee crisis (High), as of 23/12/24.</li></ul>","<ul><li>Bangladesh ranked 96 out of 163 countries in the Global Peace Index (2022).</li><li>Bangladesh ranked 149 out of 181 countries in the Corruption Perception Index (2023).</li><li>In the current period of analysis (Feb 2024) by the <a href='https://data.humdata.org/dataset/global-acute-food-insecurity-country-data', target='_blank'>IPC</a>, 20% of the population of Bangladesh are in IPC Phase 3+ (in food crisis), an estimated 14581885 people. 1% (327747 people) are estimated to be in Phase 4 (emergency).</li><li>In Bangladesh, there has been a total of 426,280 people displaced as of end of 2023 [<a href='https://data.humdata.org/dataset/idmc-internal-displacements-new-displacements-idps', target='_blank'>IDMC</a>].</li><li>There are 6 current crises and severity categories listed in the <a href=""https://www.acaps.org/en/thematics/all-topics/inform-severity-index"" target=""_blank"">INFORM Severity Index</a> for Bangladesh: 2024 Monsoon Floods in Bangladesh (High), Chronic Food Security Crisis in Bangladesh (High), Complex crisis in Bangladesh (High), Cyclone Remal (Medium), Mutliple crises in Bangladesh (High), Rohingya refugee crisis (High), as of 23/12/24.</li></ul>"
